Profile Name,Date,Data,Star
Alan,"1 year ago | Dec 25, 2022 1:16 PM","This is an upgrade of earlier Displays by Nest.  The audio is sufficient to serve as a speaker, but it is not ourstandin",Rated 2 out of 5 stars
Navynuke93,"1 year ago | Dec 25, 2022 7:15 AM",I really love this device. Definitely a game changer and I highly encourage this purchase. Great home security camera and Comes with additional Google smart home features that other devices don't have yet.,Rated 5 out of 5 stars
Navynuke93,"1 year ago | Dec 25, 2022 6:40 AM","This smart display has been nothing but amazing. I currently have it set up to be my main listening google product and I've had no issues. I setup quick phrases so that I dont need to say ""hey Google"" for things like turning on the lights and asking about the weather. It also can recognize my face so that when i look at it, I can ask it anything without saying ""hey Google"" first. The last major thing I setup was its capability to be an indoor security Cam. Currently Its set so thar when Im home, that feature is disabled, but when I'm away, it turns on. Overall, very happy with this product.",Rated 5 out of 5 stars
ScottC,"1 year ago | Dec 24, 2022 8:26 PM","The whole house has been made smart, and everything we've got works with Google. The Nest Aware subscription covers all the cameras, inside and out.",Rated 5 out of 5 stars
RonaldT,"1 year ago | Dec 24, 2022 7:53 AM","Second one I have purchased,  very handy and easy to set up..",Rated 5 out of 5 stars
MAGA,"1 year ago | Dec 24, 2022 5:51 AM",great in kitchen. large display makes easier reading of recipes,Rated 5 out of 5 stars
None,"1 year ago | Dec 23, 2022 11:02 PM","I like the features, but even on sale, I feel it was pricey.",Rated 4 out of 5 stars
Taquana,"1 year ago | Dec 23, 2022 6:27 PM",I think its not a bad google to have but i thought it did more for the price.,Rated 3 out of 5 stars
Updatedkitchen,"1 year ago | Dec 23, 2022 6:22 PM",Easy to set up and use.  Sound quality is pretty good for size and cost.,Rated 5 out of 5 stars
JakeL,"1 year ago | Dec 23, 2022 5:54 PM",Great size for viewing the doorbell and browsing questions on the assistant. Camera is nice if I want to check in on the pets.,Rated 5 out of 5 stars
Bigfoot,"1 year ago | Dec 23, 2022 4:42 PM",Bought this to set up with my door arlo camera works real good,Rated 4 out of 5 stars
BobB,"1 year ago | Dec 23, 2022 4:30 PM",Great video and picture quality. Responds as I need it do.,Rated 5 out of 5 stars
Jpowers,"1 year ago | Dec 23, 2022 4:16 PM",Love Google products and the ease of use purchased for a Christmas present,Rated 5 out of 5 stars
MelissaH,"1 year ago | Dec 23, 2022 4:13 PM","It was a great buy, have this set up in my dining room, i cant chat with my family or have full security cameras when were on vacation.",Rated 5 out of 5 stars
yusuke,"1 year ago | Dec 23, 2022 4:06 PM",Got this for my parents and make an album the family can upload picture to they loved this so much,Rated 5 out of 5 stars
JamesD,"1 year ago | Dec 22, 2022 5:25 PM",The best!! I love my hub!! displays family photo's and music perfect! I would not go with anything else in the future unless it were an upgrade to these!,Rated 5 out of 5 stars
MichaelK,"1 year ago | Dec 22, 2022 12:03 PM",The nest has come in handy in my house not only playing music but with security,Rated 5 out of 5 stars
Steve,"1 year ago | Dec 21, 2022 5:10 PM",Good size screen with good resolution. Resets and freezes a lot. There are better options available.,Rated 3 out of 5 stars
IsaacL,"1 year ago | Dec 21, 2022 3:38 PM","Good product, sometimes it doesn't hear you but overall the good services it provides are helpful",Rated 4 out of 5 stars
brettj89,"1 year ago | Dec 21, 2022 11:55 AM","This is our 2nd Hub Max, I use it at my desk under my monitors for when I want to stream music, videos, etc.  Previously used the smaller nest hub but it's just too small for me to use as a video display.  Lots of room for improvement in terms of processing speed and controls but overall a good smart display.",Rated 4 out of 5 stars
John,"1 year ago | Dec 20, 2022 5:22 PM","Got this for my kitchen. Had one of the smaller ones, and that worked okay, but this makes it feel a lot more fit for the location. I can see the screen from anywhere, and can run voice commands just by looking at it. Also, it's got the best camera functionality built in, making it a nice addition even just for security purposes. 10/10 would buy if I had space to put another one.",Rated 5 out of 5 stars
Hawkey,"1 year ago | Dec 20, 2022 2:31 PM",Great big screen. Easy to use. Nice graphics. And video calls are a breeze.,Rated 5 out of 5 stars
Steelrz4Lyf,"1 year ago | Dec 20, 2022 2:17 AM",The best video monitor Google offers is this Nest Hub Max Smart Display with Google Assistant!,Rated 5 out of 5 stars
Drew,"1 year ago | Dec 19, 2022 10:32 PM",I love the sound and how loud it can get. Very helpful when using it in the kitchen to watch recipes or even just listening to music!,Rated 5 out of 5 stars
Pooh,"1 year ago | Dec 19, 2022 2:20 PM","Love it I’m the kitchen, this is my 5th Google home product",Rated 5 out of 5 stars
Steel505,"1 year ago | Dec 18, 2022 7:48 PM",Like the indoor cam built in to watch the pets while away,Rated 5 out of 5 stars
Wags,"1 year ago | Dec 18, 2022 6:57 PM",Perfect for under my computer monitor. The experience is next level.,Rated 5 out of 5 stars
Tish70,"1 year ago | Dec 18, 2022 12:39 AM","Love my nest hub, working great, clear pictures, sounds great.",Rated 5 out of 5 stars
Gabeban,"1 year ago | Dec 17, 2022 6:52 PM","Works great definitely a must have, and easy to set up.",Rated 5 out of 5 stars
Richard,"1 year ago | Dec 17, 2022 5:59 PM","Easy to use and setup. I love how you can show footage from your cameras, or doorbells. I would recommend this compared to the smaller size.",Rated 4 out of 5 stars
LeonelG,"1 year ago | Dec 17, 2022 9:21 AM",A+++++ excellent item and perfect with my parents house,Rated 5 out of 5 stars
mmoore,"1 year ago | Dec 17, 2022 8:55 AM","This has been a great addition to our kitchen.  We can check our schedules for the day, get updated NEWS, watch a show, listen to music and even get the added feature of having a way to display our pictures.  Great product and has a great picture for photos (good colors and contrast).  I would definately do it again.",Rated 5 out of 5 stars
Wayne539,"1 year ago | Dec 17, 2022 6:15 AM","The speaker on this smart display really sounds amazing, perfect for medium sized rooms",Rated 5 out of 5 stars
JAlm,"1 year ago | Dec 16, 2022 5:35 PM",Absolutely love this! Love that I can watch my shows and read the internet from anywhere I put it!,Rated 5 out of 5 stars
RyanR,"1 year ago | Dec 16, 2022 5:03 PM","After it went on sale I figured what the hell & I was actually glad I got it once I learned how to use it!  

Now I can do enough with it that I use it regularly and enjoy the control I have over my google smart home devices as well as watching YouTubeTV, surfing the web, reaching out to family/friends/coworkers using the Google Meet app, and even dropping in to see what's going on at home when I choose to.  

You may be surprised at how much you use the Nest Hub Max!",Rated 5 out of 5 stars
Speaker,"1 year ago | Dec 16, 2022 2:47 PM",Great size and easy to use. I love cooking and watching my cooking shows. I'm able to make video calls while i cook.,Rated 5 out of 5 stars
Alex,"1 year ago | Dec 15, 2022 4:52 PM",Helps integrate everything seamlessly so i dont even have to think about it,Rated 5 out of 5 stars
JonLuc,"1 year ago | Dec 15, 2022 8:46 AM",Got several members of the family these for christmas to help everyone stay in touch.,Rated 5 out of 5 stars
Tahmid57,"1 year ago | Dec 13, 2022 11:31 PM",Great product.  I would definitely recommend my friend to buy one for upcoming Christmas.,Rated 5 out of 5 stars
Kpat,"1 year ago | Dec 13, 2022 2:42 PM",Good product for all your camera display and smart speaker. Only had for a couple weeks but no complaints so far,Rated 4 out of 5 stars
MNSF,"1 year ago | Dec 13, 2022 3:32 AM","Easy setup, decent footprint, and pleasent sound.  The only drawback is the shutter blocks both the camera and the microphone turning this into a dumb display.  Nothing a stick on shutter can't solve.",Rated 5 out of 5 stars
Nick,"1 year ago | Dec 12, 2022 12:23 PM","Netflix had problems playing on here. Might as well get a flat screen, which i did!",Rated 1 out of 5 stars
lhlady517,"1 year ago | Dec 11, 2022 6:48 PM",Nest Hub Max Smart Display is very easy to set up.,Rated 5 out of 5 stars
agsm8d,"1 year ago | Dec 11, 2022 9:48 AM",Good item to have around the house. Very intuitive,Rated 5 out of 5 stars
Kmip,"1 year ago | Dec 10, 2022 8:47 PM","Great, can control my lights form my kitchen. Would purchase again",Rated 5 out of 5 stars
Jaden,"1 year ago | Dec 10, 2022 4:20 PM",Works great and a good upgrade from my regular hub,Rated 5 out of 5 stars
JohnnyMac,"1 year ago | Dec 10, 2022 11:57 AM","Good little device, does what I need it to. Seamless installation and start up.",Rated 5 out of 5 stars
Tommy,"1 year ago | Dec 10, 2022 9:25 AM",Works great Controls all the nest products and also shows home pictures good purchase￼,Rated 5 out of 5 stars
hwmq,"1 year ago | Dec 9, 2022 6:17 PM",Upgraded from the smaller Nest Hub display.  I use this device in my kitchen and the extra screen real estate is great for looking up recipes or checking the weather from across the room.  The real reason I upgraded was for improved audio and I'm very impressed - music sounds great even at higher volumes (although I usually use it for podcasts which sound loud and clear).  Very happy with this upgrade and the price is pretty good as well.,Rated 5 out of 5 stars
CynthiaM,"1 year ago | Dec 9, 2022 4:40 PM",Works great. Very clear picture. Easy to hear noise outside,Rated 5 out of 5 stars
Jack,"1 year ago | Dec 9, 2022 3:59 PM",This thing is terrible. It only works half the time. Freezes constantly. Has to be reset daily. Do not buy.,Rated 1 out of 5 stars
AustinP,"1 year ago | Dec 9, 2022 3:23 PM",Does everything I need it to. Runs all my lights in the house and the wife uses it for recipes while she’s cooking.  Alll in all a great product.,Rated 5 out of 5 stars
Nola504,"1 year ago | Dec 8, 2022 7:35 PM","Quick, responsive and plenty of features. Get one!",Rated 5 out of 5 stars
CHAT,"1 year ago | Dec 8, 2022 1:08 PM",Great quality and reliable. It’s great to have on the side table in a bedroom.,Rated 5 out of 5 stars
Brandon,"1 year ago | Dec 8, 2022 8:43 AM",Very nice wish it was compatible with ring doorbell though,Rated 5 out of 5 stars
Samsung,"1 year ago | Dec 8, 2022 6:06 AM",Love it! The screen is really colorful and bright. Easy to understand. The camera is a plus because i can use it to monitor my home when I’m away.,Rated 5 out of 5 stars
CCheese,"1 year ago | Dec 7, 2022 1:35 PM","So far, it is very nice and convenient. It's a nice addition to the house.",Rated 5 out of 5 stars
Magillacutty,"1 year ago | Dec 6, 2022 6:13 PM","This hub is perfect for all your multimedia needs plus it works great as a assistant/organizer. The diplay is massive and the speaker sounds pretty good. Way better than the smaller, cheaper versions.",Rated 5 out of 5 stars
Erick,"1 year ago | Dec 6, 2022 2:45 PM",Google has improved the quality of his devices. Includes a Nest camera to add to your home security.,Rated 5 out of 5 stars
SaraiH,"1 year ago | Dec 5, 2022 11:13 AM",I had the previous version without the camera and loved it. This is like basically an iPad with google assistant. It is loud! The picture is perfect as well. It connects to various devices that are not google and works well. I want one in my bedroom as well!,Rated 5 out of 5 stars
Joseph,"1 year ago | Dec 5, 2022 10:26 AM",The Nest Hub Max Smart Display with Google Assistant was an outstanding purchase.,Rated 4 out of 5 stars
ELPResident,"1 year ago | Dec 4, 2022 8:16 PM",Excellent assistant for remote operations and smart routines. Easy setup and installation.,Rated 5 out of 5 stars
SoundsG00D,"1 year ago | Dec 4, 2022 1:44 PM","Although this is a relatively older device in the tech world, it’s still a very nice one! The gooogle assistant is fast and displaying photos is very nice. The display adapts with the lighting which helps the photos pop and look very clear. I particularly like that it does not show random ads as “suggestions” unlike the amazon echo show that I replaced. Highly recommend and the white model looks nice and clean.",Rated 5 out of 5 stars
UNHAPPYINPITTSFORD,"1 year ago | Dec 3, 2022 4:48 PM",Much better than Amazon's unit.  This was an upgrade.,Rated 5 out of 5 stars
podan,"1 year ago | Dec 2, 2022 11:06 PM",I bought this so i can see my grandson since they live about a 4-5 hour drive away. It works i can see him cry between 15-20 minutes 3 or 4 days  a week. This kid can cry.,Rated 5 out of 5 stars
Benny,"1 year ago | Dec 2, 2022 5:15 PM",Awesome! The camera follows you as you move around and it’s pretty cool. The best/easiest device to share family pictures through Google Cloud,Rated 5 out of 5 stars
pony,"1 year ago | Dec 2, 2022 5:01 PM",Trying to figure out how to keep it from answering my cellphone. Says to delete google assistant but I need this app. Has to be a way just have to look into it some more.,Rated 3 out of 5 stars
bestbuycustomer,"1 year ago | Dec 2, 2022 4:14 PM",Easy set up and works well.  Clear picture and sound.,Rated 5 out of 5 stars
pastorshooty,"1 year ago | Dec 2, 2022 4:13 PM",I love this. My kids love this. My wife tolerates this. It is an overall excellent product!,Rated 5 out of 5 stars
RonG,"1 year ago | Dec 2, 2022 4:04 PM",Does exactly what it’s supposed to. Full integration into Google/Nest environment.,Rated 5 out of 5 stars
Doris,"1 year ago | Dec 2, 2022 3:48 PM","I had 2 7"" Nest Hubs which were good, but I decided to try the Max, and I love it!  The sound is really good, and I use it for many things including watching TV!  Should have bought one long ago!",Rated 5 out of 5 stars
Shyam,"1 year ago | Dec 2, 2022 6:25 AM",Great one for kitchen. Good sound output and options,Rated 5 out of 5 stars
Minh,"1 year ago | Dec 1, 2022 4:22 PM",Everyone should have a few of these in their house.,Rated 4 out of 5 stars
Ricky,"1 year ago | Nov 30, 2022 6:14 PM","We had the original Nest Hub prior to this. It was our room speaker for any music we played, and on occasion, we would use it to play videos for our twin babies. Only problem was, they would often climb up along their play pen, just to get a better view of the videos playing. But with the Max, that changed instantly — now they watch from anywhere in the play pen, thanks to the three extra inches. Not to mention this doubles as a camera, so now we can step away and check on them with the Nest or Home apps. Overall, I recommend it!",Rated 5 out of 5 stars
mrtbo,"1 year ago | Nov 29, 2022 1:16 AM",The ability to work as an additional nest camera is a great feature. The facial recognition works great and the sound quality is really good.,Rated 5 out of 5 stars
tone,"1 year ago | Nov 28, 2022 2:43 PM","My wife love this Nest Hub where she can and talk to who she see, WOW!!!!!!!!!",Rated 5 out of 5 stars
JohnW,"1 year ago | Nov 27, 2022 11:04 PM",A great display a camera that can be used as security monitor,Rated 5 out of 5 stars
magozoz,"1 year ago | Nov 27, 2022 8:03 PM","I initially bought the Nest Hub 7” thinking it had a camera. Once I set it up realized it didn’t so the next day I returned it, but before I did that I had it overnight and it tracked my sleep which I loved! I didn’t have to do anything it just did it. So I returned it and got the Nest Hub Max because I thought, being more expensive, it would have everything including the sleep tracker. To my surprise, again, it doesn’t! Now I’m just annoyed at those facts. I want the sleep tracker and the camera! But I don’t need two, I’m renting a room so there’s no point for me of having both. Neat Hub Max should be able to do what the cheaper one does, I think. Anyways that’s my rant.",Rated 3 out of 5 stars
Hildi,"1 year ago | Nov 26, 2022 5:59 PM",Use it for my doorbell and it is very easy and helpful,Rated 5 out of 5 stars
SonP,"1 year ago | Nov 26, 2022 3:58 PM",Unwanted features have no options to be turned off. Nest camera keeps disconnecting and switching to display art pictures.,Rated 3 out of 5 stars
GMart1285,"1 year ago | Nov 25, 2022 6:16 PM",Very nice control center for all your smart devices!,Rated 5 out of 5 stars
SubThumpin,"1 year ago | Nov 24, 2022 3:42 PM",It's snappier than my smaller home hub has way better sound and a surprising amount of bass. Super recommended this if you have the extra cash. Also doubles as a nest cam so it's perfect to put near your front of back door for monitoring.,Rated 5 out of 5 stars
AosNex,"1 year ago | Nov 24, 2022 12:12 PM","This review is for the device, not Google assistant
Looks clean, goes great w any home
Sounds amazing for what you get. Loud, pure sound, step above average sound
Open just about any google video, music app
Even make video calls using google meet-duo
Resolution is great for what you get
Screen is a nice size, not to big or small",Rated 5 out of 5 stars
Phiho,"1 year ago | Nov 23, 2022 2:17 PM",The speaker is awesome. The ram and storage is limited therefore all apps have limited features. But it's very useful device better than the tablet.,Rated 4 out of 5 stars
Sugar,"1 year ago | Nov 23, 2022 11:11 AM","I am new at using this hub, but I like it so far.  I use it as a camera in addition to the nest cameras I purchased for my home.  Love being able to just say ""Google - and ask a question.  Always amazed at how quick answers to my questions are provided.",Rated 5 out of 5 stars
RandyTheTiger,"1 year ago | Nov 23, 2022 9:11 AM","Love it. Small quirks are, the hand gesture to start and stop music is sometimes too sensitive (will stop/start music in its own when i accidentally pick up my hand), and sometimes it doesn't pick up my hand at all!",Rated 5 out of 5 stars
NoahF,"1 year ago | Nov 22, 2022 9:54 PM",No other way to go about making your home a smart home.,Rated 5 out of 5 stars
gramfrank,"1 year ago | Nov 22, 2022 7:06 PM",Google nest is perfect for our household.  The pictures from cameras are very clear.,Rated 5 out of 5 stars
Formergeeksquademployee,"1 year ago | Nov 22, 2022 10:19 AM","Sound is lacking for how big unit is. Several bugs have been experienced as well l, between pauses while playing music to volume automatically lowering itself leading to unit having to be factory reset to fix every time. Customer service is terrible with long wait times and reps that will disconnect you mid conversation if they don’t want to troubleshoot",Rated 2 out of 5 stars
OscarP,"1 year ago | Nov 22, 2022 10:03 AM","Very easy set up, screen is nice and big. Speaker works good.",Rated 5 out of 5 stars
Anonymous,"1 year ago | Nov 21, 2022 11:22 AM",Excelente speaker good cuality good sound better than Alexa,Rated 5 out of 5 stars
Jacob,"1 year ago | Nov 21, 2022 8:26 AM","Love the size and sound. Great for the kitchen, would recommend.",Rated 5 out of 5 stars
Elimin8ter,"1 year ago | Nov 20, 2022 2:01 PM",I wish Google TV would have more support. It won't stream some movies from HBO Max,Rated 4 out of 5 stars
johnny,"1 year ago | Nov 20, 2022 1:24 PM","Love this, plus has the new wifi thread, makes it easier to connect to the nanoleaf lightbulbs",Rated 5 out of 5 stars
efinc,"1 year ago | Nov 19, 2022 4:59 PM","Love the product, i own four of these all through my home.",Rated 5 out of 5 stars
LindaT,"1 year ago | Nov 19, 2022 2:00 PM","Excellent mini speaker sound, easy setup; portable mini speaker",Rated 5 out of 5 stars
RichardR,"1 year ago | Nov 18, 2022 7:11 PM","Amazing product. Can record, play music, shows, hold contacts, and more useful features.",Rated 5 out of 5 stars
LeeB,"1 year ago | Nov 18, 2022 5:37 PM","Works as it should, great for getting information for the day, utilizing Nest thermostat and doorbell! Only issue is when losing my phone, the Google Hub Max will not ring my phone to help me find it, perhaps because the number is attached to me, but would be a great thing if they can fix that in an update in the future.",Rated 5 out of 5 stars
Louie,"1 year ago | Nov 18, 2022 3:23 PM",I like the size of it. Looking forward to try to video call on it.,Rated 5 out of 5 stars
toad4322,"1 year ago | Nov 18, 2022 1:35 PM",Works perfectly for commands and can watch Netflix directly from my nightstand now,Rated 5 out of 5 stars
Premarius,"1 year ago | Nov 18, 2022 1:12 PM",Set up is super easy and so many functions to explore!,Rated 5 out of 5 stars
VanR,"1 year ago | Nov 17, 2022 10:20 PM","Love this Max display. Works great, it has a great sound and wow what a difference in size compared to the smaller Google hub. Since it has a build in camera, it also works as a security camera.",Rated 5 out of 5 stars
Anonymous,"1 year ago | Nov 15, 2022 9:44 AM","I sit by this and it controls everything. My lights, nest thermostat and i soon will be switching from a ring to a nest doorbell to be able to view porch pirates right from my captains chair.",Rated 5 out of 5 stars
GregT,"1 year ago | Nov 14, 2022 10:48 AM","We absolutely love it, it's so convenient to control my smart lights an see ppl when they ring the Google doorbells",Rated 5 out of 5 stars
ElizabethR,"1 year ago | Nov 12, 2022 4:40 PM",Love how clear your voice is speaking to it. Havent been able to sync my google calender to it. Hopefully its just me not understanding how to dl it.,Rated 4 out of 5 stars
Asofrightnow,"1 year ago | Nov 12, 2022 1:55 PM","The display is great. The installation fell a little short after a delay for not having my speakers in the truck for the original date set and I had to set another date to get my 2 displays & 2 speakers installed. That took about 2 weeks. When the install was was done & the tech left, I discovered he didn't finish the complete setup on my bedroom display. The geek squad earned the lowered star rating.",Rated 4 out of 5 stars
Asofrightnow,"1 year ago | Nov 12, 2022 1:37 PM",Everything is going great from installation so far. The only complaint is the days it took for installation from the day received after a delay or 2.,Rated 5 out of 5 stars
Sadie,"1 year ago | Nov 12, 2022 2:37 AM",It is nice to be able to ask a question and get the answer without having to empty your hands to pick up your phone. It works well with our video doorbells too.,Rated 5 out of 5 stars
SamH,"1 year ago | Nov 11, 2022 4:37 PM","This is m 2nd Nest Hub Max Smart Display. I have tried Alexa in between, but the abilities of Google, its superior performance, and seamless integration with your TV, cell phone, and home IoT make it a logical choice. I have not run into any issues with this device. The color is nice and relatively easy to keep it clean.",Rated 5 out of 5 stars
Davamh,"1 year ago | Nov 11, 2022 3:51 PM","I really like the Hub max, it's easy to setup and use to begin with. Some of my favorite features are being able to setup a shared photo group which allows myself and to brothers to view and share pictures. It's also good for listening to music on Spotify and other music services. Playing trivia and other games is fun and I also use it to control my devices.",Rated 5 out of 5 stars
RPK257,"1 year ago | Nov 11, 2022 3:35 PM",The Nest Hub Max works great with my Google home. The display is nice and large enough to see from the other side of the family room as it rotates pictures. Looks good too.,Rated 5 out of 5 stars
PrimePower,"1 year ago | Nov 11, 2022 2:44 PM",I really only purchased this because casting to my home chromecast devices for music was not working well on my phone. This works first time every time. The rest of the features I have no use for.,Rated 5 out of 5 stars
AaronS,"1 year ago | Nov 11, 2022 10:04 AM","Works great for reminders, tasks and photo frame. Easy to load images and plays music with ease.",Rated 5 out of 5 stars
Locsta,"1 year ago | Nov 8, 2022 4:33 PM",Works great. Links with all google products . Ok have them all around the house,Rated 5 out of 5 stars
Alfa1,"1 year ago | Nov 7, 2022 10:33 AM","Changing from Alexa to google,im finding that google is much more responsive,and does not need detailed instructions.",Rated 5 out of 5 stars
Pitoon,"1 year ago | Nov 7, 2022 8:50 AM",This device is great in the kitchen. We use it frequently and have it set to display photos as well!,Rated 5 out of 5 stars
TeraG,"1 year ago | Nov 6, 2022 9:25 PM","We have a Google hub in every room and Google Nest in the kitchen and my office. I love these, but I wish I could get a proper consultation to help me use them to their full potential.",Rated 5 out of 5 stars
willp,"1 year ago | Nov 6, 2022 12:32 PM",wish ui was more customizable. The YouTube app isn't intuitive,Rated 4 out of 5 stars
NJVA,"1 year ago | Nov 6, 2022 11:23 AM","Excellent product, and also has a camera to record and security. The sound to listen to songs is decent, it is not spectacular but it is acceptable. To use the camera I recommend a subscription to NEST AWARE Storage & Security, and if you have the Google Nest doorbell they work well together with Max Display. It has a physical button on the back to turn off the camera.",Rated 5 out of 5 stars
texjon,"1 year ago | Nov 6, 2022 7:38 AM",I have the smaller nest display as well. The larger screen and the added camera makes this a much better option for me.,Rated 5 out of 5 stars
