Profile Name,Date,Data,Star
coffeeguy,"1 year ago | Aug 24, 2023 8:20 AM","This is my second Nest Hub Max and I rely on it to get me through the workday. I use it to set reminders, set timers, and ask it questions. The screen is crisp and the sound is strong. The camera allows me to check the house when I'm away, which is a plus.",Rated 5 out of 5 stars
Rhonda,"1 year ago | Aug 22, 2023 7:25 AM","Easy to use, very convenient to watch streaming services.",Rated 5 out of 5 stars
Robster,"1 year ago | Aug 20, 2023 5:22 PM",Love the way we are able to built our own home security system.,Rated 5 out of 5 stars
Anonymous,"1 year ago | Aug 20, 2023 9:59 AM","This is the most aggravating product you will ever own.  When it actually hears you, there is about a 40% chance it will get your request correct.

No calendar because who wants a display that shows them their daily plans??

Worst of all, the camera quit working after 7.5 months, so we’re heading to Best Buy for product support or a replacement (only because we can’t trade it in for something else).

Do not buy this!!  Save your money and bash your head against the wall a few times, you’ll get the same experience.",Rated 1 out of 5 stars
RobertL,"1 year ago | Aug 19, 2023 2:17 PM","I frequently make video calls from work to home and this was a good choice.  We use it to play music, podcasts, and set alarms.",Rated 5 out of 5 stars
Teacher47,"1 year ago | Aug 18, 2023 9:11 PM","This has been added to our kitchen and I absolutely love it!  I will ask for recipes or music, and they are presented to me very quickly hands-free!  Set up was so easy too.",Rated 5 out of 5 stars
GoogleDevice,"1 year ago | Aug 18, 2023 7:12 PM",Its ok i like Alexa Better And im a google girl its just something about this that could be better,Rated 4 out of 5 stars
Pubz,"1 year ago | Aug 18, 2023 5:00 PM","Best product for ppl who is far , which feel they are near to us . Connecting ppl around the world with just voice control. Now my home is fully voice controlled by this. Remmeded devices specifically who have life busy !!!!",Rated 5 out of 5 stars
Bemom1234,"1 year ago | Aug 18, 2023 4:33 PM",It works well as described. I can user it as iPad in my kitchen. Definitely recommend for my friends.,Rated 5 out of 5 stars
Josh,"1 year ago | Aug 18, 2023 3:55 PM","Bought this for my wife as a gift and so far she absolutely loves it, not much more to say other than it works as expected.",Rated 5 out of 5 stars
Sonos,"1 year ago | Aug 18, 2023 3:46 PM",Wish the camera had night night vision to see in the dark. Overall it’s a nice product.,Rated 4 out of 5 stars
MichelleP,"1 year ago | Aug 18, 2023 3:39 PM",excellent product to gift to parents and family! Price can’t be beat.,Rated 5 out of 5 stars
Makaveli1,"1 year ago | Aug 18, 2023 3:38 PM",I love the larger size screen than the original. Easier to see people when they ring the Google Doorbell. Also love seeing the outside temp and weather forecast displayed on the larger screen.,Rated 5 out of 5 stars
DamareoB,"1 year ago | Aug 17, 2023 1:39 PM",We love the Google home device. It plays all our old photos and does a great job at playing music.,Rated 5 out of 5 stars
Anonymous,"1 year ago | Aug 16, 2023 4:36 PM","I have 2 in the bedroom on the nightstands, one in the kitchen, one in the office, one in the den, they're fantastic.",Rated 5 out of 5 stars
Superduperkirky,"1 year ago | Aug 15, 2023 9:07 AM","If you have a google Ecosystem, then this is a just for the kitchen or a larger entertaining area.  It has the same issue as the 7"" to where you need to ywll at it sometimes even when theemre is no additional sound in the area. Otherwise, it's a great purchase.",Rated 4 out of 5 stars
JudithP,"1 year ago | Aug 14, 2023 1:12 PM",I love it !!! Great product have it in my kitchen good for recipes,Rated 5 out of 5 stars
ITSALANTROY,"1 year ago | Aug 13, 2023 10:52 AM","I love this product takes a little bit to get used to the sound quality is phenomenal. My only flaw is when I say. Hey Google play a certain song such as Shivers by Ed Sheeran. It always wants to play the remix version so I wish there was a way that you could, set it not to play remix or something like that",Rated 5 out of 5 stars
sbl1977,"1 year ago | Aug 13, 2023 8:36 AM","I really Like the Nest Hub, Great addition to our and Home when it comes to technology.",Rated 5 out of 5 stars
JCinOC,"1 year ago | Aug 12, 2023 12:40 PM",very usefule fixture on my kitchen counter. I love the voice control of the home automation.,Rated 5 out of 5 stars
Antwan,"1 year ago | Aug 12, 2023 10:38 AM","I do want to start this review off by saying that I have an Apple phone and watch, I use Amazon all the time, and I’m familiar with Alexa and have other family members that use Alexa. However, Google Assistant has been the best voice assistant on the market so far.this is greatly due to the natural voice understanding that Google has. There is no need to say things, monotonous or robotically to a voice assistant like Siri or Alexa, because Google is able to understand natural language, and what you are asking of it. It’s many great functions and compatibility with Google Calendar and other task are an awesome addition to the house and a great help when you’re living a busy life",Rated 5 out of 5 stars
Bruce,"1 year ago | Aug 12, 2023 7:32 AM","Wish Google had better parental controls, but the hub Max is great!",Rated 5 out of 5 stars
KnnT,"1 year ago | Aug 12, 2023 7:17 AM","Bought 2 of these at a great price, using to see cameras around my house!! Great picture.",Rated 5 out of 5 stars
KnnT,"1 year ago | Aug 12, 2023 7:11 AM","Best thing it stays on the screen. Ask to spell things it doesn't go away. Until you say go back to the home screen, echo lets you see it for 25 sec then it goes way. This is the best thing i like",Rated 4 out of 5 stars
JesseG,"1 year ago | Aug 11, 2023 7:31 PM","Amazing, love everything about it!!! Great interface, easy to use and would recommend to anyone.",Rated 5 out of 5 stars
NeilT,"1 year ago | Aug 11, 2023 5:12 PM",Worst purchase ever. Try again in a few minutes… right!,Rated 1 out of 5 stars
DulceG,"1 year ago | Aug 11, 2023 5:04 PM","Love it has so many apps available, great pictures and volume gets pretty loud",Rated 5 out of 5 stars
LuzR,"1 year ago | Aug 11, 2023 3:25 PM","Love it, this device is
The best purchase I
Made, it was slot of features like reminders I also like the update it had that u no longer have to say hey Google by looking at it it will listen",Rated 5 out of 5 stars
LorenV,"1 year ago | Aug 8, 2023 9:43 PM",Love the size of the screen. So much more fluid than other monitors like it!,Rated 5 out of 5 stars
NJROC,"1 year ago | Aug 5, 2023 5:25 PM",The second of these units which is in my home and it was faster and easeier to set up than the original unit I got 2 years ago. This product is consistently improving.,Rated 5 out of 5 stars
MichelleC,"1 year ago | Aug 5, 2023 1:20 PM",We love this! Works amazing to communicate with my mom so she can see us live when we aren’t close by. The photos scrolling through the home page make this even better!,Rated 5 out of 5 stars
tstaup,"1 year ago | Aug 5, 2023 9:23 AM","I love the voice assistant features, but my favorite part is the google photo sharing. I have an album that auto recognizes my wofe and daughter to show every pic of them on a loop. Its awesome",Rated 5 out of 5 stars
ChristopherH,"1 year ago | Aug 5, 2023 8:08 AM",Camera view from 15 ft is garbage can’t tell who the person is. Camera just stops recording and you have to reset it and then do it all over again in a few days,Rated 1 out of 5 stars
YulandeB,"1 year ago | Aug 4, 2023 7:01 PM","Let me tell you,  if your into home technology, get you a google home. From controling the lights, to the tv, the ac units, to getting infor.ati9n right at your finger tips. My son who is 7 started talking to google in secret at 3 when we wouldnt talk and we caught him.  I have had google home since 2017 and i absolutely love it.",Rated 5 out of 5 stars
Sraone,"1 year ago | Aug 1, 2023 1:14 PM",Best for family use. Easy and android. Will buy few more,Rated 5 out of 5 stars
TeresaE,"1 year ago | Jul 28, 2023 10:34 PM",I’m learning this product and really enjoy getting music and recipes.,Rated 5 out of 5 stars
RickC,"1 year ago | Jul 28, 2023 6:43 PM",Works great and easy to use.  I am going to pick up another one.,Rated 5 out of 5 stars
Laura,"1 year ago | Jul 28, 2023 6:37 PM",Great sound. Veery easy to manage and use. Super nice design,Rated 5 out of 5 stars
RR13,"1 year ago | Jul 28, 2023 5:18 PM","We already had several of the smaller Nest Hubs around the house, but it's so nice to have a bigger display. The only downside is you can't (or at least I wouldn't) use in a bedroom because of the camera.",Rated 5 out of 5 stars
bgc1290,"1 year ago | Jul 26, 2023 6:21 AM",I'm loving this product! It was easy to set up and works well with my Android devices and music/streaming services.,Rated 4 out of 5 stars
EduardoF,"1 year ago | Jul 22, 2023 11:38 AM",Connected to the internet right away. If it losses signal cause of provider it reconnects back on its own. Great image and ease of use,Rated 5 out of 5 stars
Sean,"1 year ago | Jul 22, 2023 9:46 AM",Love our hub. Works well with other google/nest products. Ordered a pick up at Best Buy in the morning and it was ready when I went to pick it up in the afternoon.,Rated 5 out of 5 stars
user275806,"1 year ago | Jul 22, 2023 9:35 AM","Easy, at-home shopping makes my life much easier! Nice!",Rated 5 out of 5 stars
LeslyD,"1 year ago | Jul 22, 2023 4:39 AM","The sales price, the rebate  were very attractive. The quality of the sound, the clarity of the images even at night... I recommend Nest over all the other brands...",Rated 5 out of 5 stars
Christymomof6,"1 year ago | Jul 21, 2023 10:30 PM","The speakers on this are great! They were relatively easy to set up, and they are even easier to use!",Rated 5 out of 5 stars
OXI102840,"1 year ago | Jul 21, 2023 6:54 PM","Great display for our kitchen, our best is connected to it, it does get a times finicky when playing music. iTunes doesn’t always connect",Rated 3 out of 5 stars
ChrisB,"1 year ago | Jul 21, 2023 6:33 PM",Loud and best quality. Very easy to set up would recommend,Rated 5 out of 5 stars
NolanFan,"1 year ago | Jul 21, 2023 3:33 PM","This was my second Nest Hub Max, for my parents, since they loved my own. My parents love the photo frame with a slideshow of their photo memories, plus a voice assistant with video calling, and even doubles as a home security camera!",Rated 5 out of 5 stars
Beauritchie,"1 year ago | Jul 20, 2023 6:17 PM",We use this everyday. Helps us in thr kitchen and connting with family. The speakers sound great with music playing.  Screen resolution is perfect as well.,Rated 5 out of 5 stars
Eddy,"1 year ago | Jul 20, 2023 5:05 PM",It works as advertise. I will recomend this product,Rated 5 out of 5 stars
Crap,"1 year ago | Jul 20, 2023 2:10 PM","We had our google for less than 1 month.  We played music for about an hour then it stopped playing.   The next day the same thing.  Today I walked past the google and it made a loud noise and the screen went blank.   Of course Best Buy can’t do a refund because it’s past 15 days. Obviously, the issues arise after the return date is met.",Rated 1 out of 5 stars
Orcajada,"1 year ago | Jul 19, 2023 4:08 PM","￼This item is great for anything. I can make voice commands, listen to music, and stream security cameras amongst other things. There’s a lot of items that are compatible with Hey Google. Definitely recommend this item!",Rated 5 out of 5 stars
LaurieL,"1 year ago | Jul 19, 2023 8:19 AM",This was the best purchase for the whole family. We bought one for our home and another for my sister!! My 2 year old watched his videos on it and I watch cooking recipes and we listen to music! And So much more!,Rated 5 out of 5 stars
JudithL,"1 year ago | Jul 16, 2023 6:12 AM","I love this camera
 I would recommend this product.",Rated 5 out of 5 stars
Patricia,"1 year ago | Jul 15, 2023 1:12 PM",gives me greater flexibility.  Love the options and I am still learning.,Rated 5 out of 5 stars
JohnH,"1 year ago | Jul 15, 2023 10:00 AM","This smart display hub is perfect in my kitchen, ask it how to make certain dishes, what the weather will be, or check the front door nest camera.",Rated 5 out of 5 stars
Samuel,"1 year ago | Jul 15, 2023 9:11 AM","Awesome,  the best device never got, I'm really recommending",Rated 5 out of 5 stars
willyjack,"1 year ago | Jul 15, 2023 7:50 AM","We pitched this as a central unit to control cameras, music, etc. from our kitchen. My wife also loves having the ability to Google search for recipes, set cooking timers, and video chat with family. We love this addition to our Google home automation.",Rated 5 out of 5 stars
Shipwreck,"1 year ago | Jul 14, 2023 9:45 PM",Google makes the best in home devices everyone should have one.,Rated 4 out of 5 stars
AnubhavG,"1 year ago | Jul 14, 2023 7:35 PM",Very good. Works great. Nice deal from best buy. Will buy again,Rated 5 out of 5 stars
GilMar,"1 year ago | Jul 14, 2023 4:03 PM","Great to have for home Hub and Google camera's, a little disappointed with the resolution on the screen.",Rated 4 out of 5 stars
AnthonyG,"1 year ago | Jul 14, 2023 11:45 AM","Hi tech, efficient reliable, home is much safer for it",Rated 5 out of 5 stars
Anonymous,"1 year ago | Jul 14, 2023 11:34 AM","Got it for the mother of my son as a Mother’s Day gift and she loved it, we have it in our kitchen to play music , ask questions on what to cook for the night , check weather , news , contact family etc great product",Rated 5 out of 5 stars
Consumer,"1 year ago | Jul 13, 2023 6:29 AM",I purchased this item and it was linked to another device already. Really disappointed because it was sold to me as “new”.,Rated 1 out of 5 stars
Gwizz,"1 year ago | Jul 9, 2023 1:59 PM","Has everything i was looking for in a smart home device. Integrates with my calendar, appliances and security system with ease. It's reliable and easy to configure. If you are standardized in the Google platform its a no brainer.",Rated 5 out of 5 stars
Josh,"1 year ago | Jul 9, 2023 9:46 AM",This is one of the best device i own. I would recommend this over a Alexa any day,Rated 5 out of 5 stars
FrankU,"1 year ago | Jul 8, 2023 8:13 AM","This unit has been a perfect unit for us, my grandson was able to speak with his mom when she video called. The ease of connecting you Google account was very easy. Using the Nest cam to check in was very helpful. So this unit can become very useful and be part of your daily life. Make it a bit easier.",Rated 5 out of 5 stars
MaddyW,"1 year ago | Jul 7, 2023 11:14 PM",Shipping was super fast and am enjoying my Nest Hub! It fit very well and I was able to set lights up smart lights and connect my other Google devices. Still learning how to use it but it’s pretty easy!,Rated 5 out of 5 stars
JDH1,"1 year ago | Jul 7, 2023 10:18 PM",Superior quality producer. Very pleased with the product.,Rated 5 out of 5 stars
TommisC,"1 year ago | Jul 7, 2023 9:25 PM",So far this is easy to use love it. If you like google I'd get it.,Rated 5 out of 5 stars
KyleC,"1 year ago | Jul 7, 2023 8:43 PM","Easy to use, works well with nest camera devices for ease of viewing live video. Sleek and modern, looks nice.",Rated 5 out of 5 stars
JEDunnam83,"1 year ago | Jul 7, 2023 7:28 PM",I have a full Google Assistant Smart Home Ecosystem. I love using the Google Nest Hub Max to help automate my home. It’s ability to work with multiple smart devices in my home make it so awesome. Great sound. Amazing features. Top of the line product!,Rated 5 out of 5 stars
YaminahG,"1 year ago | Jul 7, 2023 6:28 PM","Does a great job monitoring the house, synced with multiple devices and comes in handy when needing quick answers!",Rated 5 out of 5 stars
Anonymous,"1 year ago | Jul 5, 2023 1:15 AM",Its a good device but does not have lot of features. The new google pixel tablet is lot better buy than this one.,Rated 4 out of 5 stars
Bcassatt,"1 year ago | Jul 4, 2023 9:34 PM",Super convenient to use with Nest Doorbell ans cameras.,Rated 5 out of 5 stars
Malcolm,"1 year ago | Jul 2, 2023 4:00 AM",Got this one for an upgrade for my existing Nest screens but decided the updates were enoigh to justify the price.,Rated 4 out of 5 stars
User715939,"1 year ago | Jul 2, 2023 1:21 AM","Love our Google Home, but I wish it did more. To connect any apps or devices you have to do this through the phone app, rather than from the Google Home device itself.  It’s functions are limited- such as k want to connect my ring door bell and be able to view my front porch from it, but it doesn’t do this. If it does, the set up is so complicated that I have yet to figure it out.",Rated 4 out of 5 stars
TonyFL,"1 year ago | Jul 1, 2023 8:16 AM",Camera stopped working and google still hasn't fixed this known issue since 2020 but that's what happens when they are too busy working for corruptPoliticians.,Rated 1 out of 5 stars
StevenR,"1 year ago | Jul 1, 2023 8:12 AM",Only thing I don’t like is the camera is tilted towards ceiling,Rated 5 out of 5 stars
EugeneH,"1 year ago | Jul 1, 2023 4:31 AM",Just the right size for nightstand with good display and reasonable sound however the Nest Hub Max provides better performance and sound quality,Rated 4 out of 5 stars
Benie,"1 year ago | Jun 30, 2023 11:19 PM",Alexa my favorite for watching You tube and monitoring my security camera and social media + other function for smart home,Rated 5 out of 5 stars
ShawnM,"1 year ago | Jun 30, 2023 8:36 PM",The sound of the google home with the large pleasing screen to see the video. Good stuff,Rated 5 out of 5 stars
RyanB,"1 year ago | Jun 30, 2023 7:29 PM","Google Nest Hub Max: Versatile, Smart, and Stylish! ★★★★★",Rated 5 out of 5 stars
Kingcd,"1 year ago | Jun 30, 2023 7:08 PM",My entire family benefits from it being in the kitchen.,Rated 5 out of 5 stars
Nacho,"1 year ago | Jun 30, 2023 7:05 PM",Several months ago I purchased a pair of Google Nest Hub Max.  The experience was so great that I recently bought another pair of these displays.  These four devices are an important part of my home security system.,Rated 5 out of 5 stars
EduardoA,"1 year ago | Jun 30, 2023 6:14 PM",Definitely worth getting the max. Keep in kitchen and is amazing for all needs.,Rated 5 out of 5 stars
ChristinaO,"1 year ago | Jun 30, 2023 6:10 PM",Use this for everything.  Great for saving recipes,Rated 5 out of 5 stars
JONESnLA,"1 year ago | Jun 30, 2023 4:06 PM","I ordered 2 of these for Mother's Day gifts. They were so easy for them to set up as Google led them through step by step. They both have iPhones but can now let Google turn on things around the house. This also gives me options to build on this system for future gifts such as all of the smart things. We are a Samsung family so ultimately these were purchased for video calling the grandparents. Ive had on fir years and use it in my kitchen for cooking and controling my smart things. I misplace my phone around the house often. I say, Hey Google, where's my phone? She replys then makes it ring until i unlock it. THAT is the most helpful and a hige tome saver. I now have a 2nd one for my master bath and I cant get enough!",Rated 5 out of 5 stars
LuisS,"1 year ago | Jun 29, 2023 10:40 AM","Wonderful product, very practical, easy to configure",Rated 5 out of 5 stars
DavidV,"1 year ago | Jun 29, 2023 9:31 AM","CONSTANTLY looses connection to wifi even though nothing else in the house does.  Our other Nest Hub 7"" displays never loose connectivity.  I smashed our Max display into a million pieces last night because I just couldn't take it anymore.  Do some searches, others have the same issues with this device.  JUNK.",Rated 1 out of 5 stars
SteveR,"1 year ago | Jun 26, 2023 7:43 AM","Great upgrade over the Google Hub! Speaker is powerful for its size, and the screen is perfect size for streaming video or just using for your smart home management.",Rated 5 out of 5 stars
JayDee,"1 year ago | Jun 24, 2023 11:58 AM",I love these so much. Makes life just that much more streamlined and easier to control smart home. I wish Google/nest items didnt cost so mush compared to competitors but I keep buying cause they are worth it.,Rated 5 out of 5 stars
PatriciaC,"1 year ago | Jun 23, 2023 9:59 PM",This is best anyone can have I would love to buy more if I can.,Rated 5 out of 5 stars
PatriciaC,"1 year ago | Jun 23, 2023 9:55 PM",Love this. Love Alexa love asking Alexa for weather,Rated 5 out of 5 stars
Anonymous,"1 year ago | Jun 23, 2023 8:32 PM","Easy setup, and works with all my at home controls.",Rated 5 out of 5 stars
JordanD,"1 year ago | Jun 23, 2023 5:14 PM","Wonderful device overall, which it was priced lower.",Rated 5 out of 5 stars
Loco1529,"1 year ago | Jun 23, 2023 2:53 PM",I really like it as much as it really leaves mich to desire. The sound is good. It has great features. It just doesn't always land the features. Usually is getting better with the updates.,Rated 3 out of 5 stars
PaulA,"1 year ago | Jun 23, 2023 8:52 AM","Setup is easy. There is a known problem that Google has failed to fix for several months now. I own 3 of these devices and all 3 have the same problem. The photo frame feature is constantly getting stuck while displaying photos. You can verbally instruct Google to advance to the next photo, but who wants to keep doing that dozens of times each day.",Rated 2 out of 5 stars
MrMovieman,"1 year ago | Jun 23, 2023 4:01 AM",Very good product if you have a smart home. I can do everything with this item from turning on my lights to turning on the a/c,Rated 5 out of 5 stars
Sharpe529,"1 year ago | Jun 17, 2023 9:55 AM","Should be in every home. Central hub for cooking, weather, music",Rated 5 out of 5 stars
Howie,"1 year ago | Jun 15, 2023 8:53 PM","Great sound coming from a small device.  The bass is enough to blast the whole living room!!  Its a smart device, but the best perk for me is the ability to link with my google photos for display",Rated 5 out of 5 stars
Jkstudio,"1 year ago | Jun 14, 2023 12:45 PM",I can use this for my home and for my work! You can also use it to call just anout anyone even iphones and do facetime! I set up gopgle meet and voice for my son to use this for a free home phone! I bought mine full price! But it is still worth it and i can connect all my cameras and home appliences! I must say Google did very well! Im an apple user as i am a designer but i use google for my work emsilad and all pther work related apps and this just made my day go so much smoother! Price is def very high! But to have all that in one and google to assists you? Im super happy! Hopefully they upgrade the mini google hub tso you can make phone calls and facetime on that as well! I would most definitely get the smaller one for my sons room and for him to be assisted too!,Rated 5 out of 5 stars
AAPH,"1 year ago | Jun 10, 2023 4:57 PM","This device delivers exactly what it says it does. The screen is great, and the sound is a notable upgrade over previous hub speakers. For the price, it’s still a hard swing. I would probably go for a Sonos speaker in hindsight.",Rated 4 out of 5 stars
Lenovo,"1 year ago | Jun 10, 2023 1:10 PM",Third one purchased for the family and friends. Great way to stay connected.,Rated 5 out of 5 stars
WapitiSprings,"1 year ago | Jun 10, 2023 7:39 AM",This has been such a great product for me! I can see whos at the door while im sitting at my desk. I have used it for a television and can check on the status of my house. Have even used the brodcast feature to get a family anouncement out to all rooms with a mini. Works great.,Rated 5 out of 5 stars
CEB17,"1 year ago | Jun 10, 2023 12:22 AM",This has been a great addition to my home. Has to be reset sometimes because it will stop alerting to movement. I have used mine for 2 years.,Rated 4 out of 5 stars
Nature1439,"1 year ago | Jun 9, 2023 7:33 PM","Returned to store as my husband prefered our echo display. However, I loved it!",Rated 2 out of 5 stars
Dclaw,"1 year ago | Jun 9, 2023 4:13 PM",This is by far the better coice for a google nest speaker/camera device.  does all of the things you need all in one spot with a picture fram to boot!!,Rated 5 out of 5 stars
McGriff,"1 year ago | Jun 6, 2023 4:48 PM",My wife and I love our Hub Max and use it almost everyday.,Rated 5 out of 5 stars
Brady,"1 year ago | Jun 5, 2023 3:52 PM",Extremely useless. I'd recommend a cheap tablet and dock instead. In the two months I've had this they've downgraded or removed the few features I use and it's already very limited in what it can do.,Rated 1 out of 5 stars
Dyson,"1 year ago | Jun 4, 2023 6:04 PM",Had an older version with the smaller screen  purchased this one on Black Friday for a good deal.  This has a larger screen plus awesome speakers to it.  Plus since I  have an Apple phone and can use the Google duo to video chat with people who have android phones.,Rated 5 out of 5 stars
WesS,"1 year ago | Jun 4, 2023 1:18 PM",This hub work excellent in our kitchen for music and keeping track of our day to day activities and watching over all of our nest home equipment,Rated 5 out of 5 stars
JoshB,"1 year ago | Jun 4, 2023 7:26 AM","Amazing, got this to upgrade from the smaller one , love it works so much better , and love all the extra features. Made a great Mother’s Day gift",Rated 5 out of 5 stars
