Profile Name,Date,Data,Star
MarkoS,"1 week ago | Aug 31, 2024 8:11 AM",Love my new google nest hub max.  Order it online went to the store to pick it up didn't have to wait not even 15 minutes and it was in my hand and out the dor . Great service,Rated 5 out of 5 stars
Art406,"1 week ago | Aug 30, 2024 6:39 PM","This is our 3rd Google Hub Max, very happy & satisfied with all my purchase.",Rated 5 out of 5 stars
CesarB,"1 week ago | Aug 30, 2024 2:35 PM","The setup was quick and easy. 
I use it daily while I make food for the kiddos.",Rated 5 out of 5 stars
Marmar,"1 week ago | Aug 30, 2024 12:03 PM",All I can say is I love it. Easy to hook up & sound quality is amazing!! Purchased one for my mom & I & mom loves it as well!!!,Rated 5 out of 5 stars
Dshah,"1 week ago | Aug 30, 2024 11:52 AM","Large  display, enjoying , very easy to use. Customer service was very good, helped me with the decision. 
decision",Rated 4 out of 5 stars
MonteM,"1 week ago | Aug 26, 2024 11:10 PM","Great picture and easy to use with all my other smart products as outdoor cameras, doorbell and light bulbs. I love how i can control music from the hub to my speakers and mini hubs throughout the house. Even the bathrooms, every room is a concert",Rated 5 out of 5 stars
JohansM,"2 weeks ago | Aug 23, 2024 9:34 PM",Best for smart home the response is quick and the latest version is easy to use,Rated 5 out of 5 stars
GFNY,"2 weeks ago | Aug 23, 2024 11:37 AM",Great product for quick view of days events and weather.,Rated 5 out of 5 stars
LgFan,"2 weeks ago | Aug 18, 2024 10:49 PM","Pretty good overall.  My main complaint is that I have to have the camera on to use gestures.  I don't like having the camera on at all times.
Had been looking at this for some time and when they knocked $100 off the price, I added $30 in reward certificates so it just cost $100.  Certainly worth that.",Rated 4 out of 5 stars
XenoCain,"3 weeks ago | Aug 13, 2024 4:57 PM","I love all my other Nest products, but this thing is absolutely useless! I bought this months ago and finally set it up. Unfortunately, I'm past the return window or I would return it. It can't do anything effectively. 

The interface is awful, the search search system crashes all the time, the screen times out and doesn't save where you left off, you can't jump between apps or 'background' anything and come back to it, hardly any apps are available for it. I don't understand what Google's goal for this product is if it can't at least do what a phone or tablet can.

I can't think of a single good reason to buy this product. I would have been way better off just buying a tablet and a stand for it.",Rated 1 out of 5 stars
BettyB,"1 month ago | Aug 9, 2024 7:24 PM",It’s so handy and convenient whenever I have a question or a need to hear a song on my mind.,Rated 5 out of 5 stars
RosaM,"1 month ago | Aug 9, 2024 11:27 AM",Great and easy product to have at the house love it,Rated 5 out of 5 stars
4Cujo,"1 month ago | Aug 9, 2024 11:14 AM",This was a great purchase and upgrade from the earlier Hub version.  The price was incredible!,Rated 5 out of 5 stars
suhey,"1 month ago | Aug 9, 2024 10:16 AM","The Nest Hub Max is the perfect product for my home office.  I can steam iHeart Radio, Apple Music, as well as view my family photos on a larger screen.",Rated 5 out of 5 stars
Tido54,"1 month ago | Aug 7, 2024 4:36 PM",Great item work good with youtube music would recommend,Rated 5 out of 5 stars
Villageanne,"1 month ago | Aug 5, 2024 3:09 PM",Last Christmas I replaced both our daughters Google Home Hub with the Google Max. Last week I replaced my husbands and I also purchased myself one.  The Google MAX does so much more than the smaller Google Hub. It has a camera and microphone making it easy to chat live with the Grandkids. I am still learning what all it do but I’ve learned that I can have Google find just about anything quicker than I can open an APP. Google even opens YouTube to my specified music or video.  I love it. My husband uses his in bedroom for an alarm clock.  I use mine mostly in living room studying.  It is more expensive than the home hub but goes on sale making it affordable. It is larger and more attractive in both rooms.,Rated 4 out of 5 stars
Natasha,"1 month ago | Aug 2, 2024 11:08 PM",Way better than the Pixel!  The Pixel does not offer home monitoring. Hopefully they don’t discontinue this one.,Rated 5 out of 5 stars
ChristopherS,"1 month ago | Aug 2, 2024 4:15 PM","Its like having a small interactive tv! If youre thinking about buying one, its worth it. I use it more than i thought I would.",Rated 5 out of 5 stars
Ranger1,"1 month ago | Jul 30, 2024 4:46 PM",Great screen quality and the sound quality is crisp and gets fairly loud!,Rated 5 out of 5 stars
Simba,"1 month ago | Jul 30, 2024 12:31 PM","The Nest Hub Max is like having a helpful assistant in your home. This charcoal-colored smart display fits nicely in most rooms and does a lot more than you might expect. The 10-inch screen is crisp and clear, great for watching recipes while cooking or checking your calendar. Video calls are a breeze - just say ""Hey Google, call Mom"" and you're connected. The camera quality is good, making it easy for friends and family to see you clearly. Sound-wise, it's impressive for its size. The built-in speakers and subwoofer pump out decent audio, whether you're listening to music or watching videos. Google Assistant is the star here. It responds quickly to voice commands, helping you set timers, control smart home devices, or get quick answers to questions. On the downside, privacy might be a concern for some. There's a camera and microphone involved, though you can turn these off. Also, while it's not cheap, it offers good value for what it does.
Keep in mind, you'll get the most out of this if you're already using Google services or have other smart home devices.",Rated 5 out of 5 stars
JohnH,"1 month ago | Jul 27, 2024 3:20 PM",An exellent device! The sound quality is so much better than expected. Sometime google is a bit finicky but otherwise well worth it.,Rated 5 out of 5 stars
RoseS,"1 month ago | Jul 26, 2024 1:30 PM","Awesome product, great to listen to outdoors and screen very visable",Rated 5 out of 5 stars
JenniferB,"1 month ago | Jul 18, 2024 8:29 PM","Oh my , it is AMAZING!!! 
I ABSOLUTELY LOVE IT,  My child as well!! Google did it BIG ON THIS ONE! 
A MUST HAVE!! It does EVERYTHING!",Rated 5 out of 5 stars
BennyJ,"1 month ago | Jul 16, 2024 7:44 AM","Okay so now this is a review that you can really sink your teeth into so grab a quick seat.

So why should you get this, its a smart speaker, camera, assistant, and internet encyclopedia and we haven't even gotten to the back of the box. You can use your voice, the  touch screen, and hand gestures to interface with it and its all extremely responsive and accurate. 

This is what you need if you are looking for the first piece of your smart home project. Look no further!",Rated 5 out of 5 stars
Allan,"1 month ago | Jul 12, 2024 12:26 PM",Love the vividness and clarity of the hoots and versatility of this item,Rated 5 out of 5 stars
Sarah,"1 month ago | Jul 10, 2024 1:11 PM",I love it and can see that clear camera when I use nest app.,Rated 5 out of 5 stars
GingerFanboy,"2 months ago | Jun 28, 2024 8:35 PM",Google products have come a long way! and the wife loves it for the picture display easy selling point guys wink wink,Rated 5 out of 5 stars
AndriyS,"2 months ago | Jun 28, 2024 4:17 PM","This smart home device is a joke. It broke in less than two years. Google can do nothing since the warranty period ended. 
Do not recommend. I was using it as a way hoto frame and music player occasionally, it has limited functionality and minimal lifespan. Google doesn’t value their customers and build products that will break once warranty is over.",Rated 1 out of 5 stars
Adithya,"2 months ago | Jun 27, 2024 11:41 AM",All the devices  keep disconnecting to this one and needs a manual connection again,Rated 3 out of 5 stars
CharlesC,"2 months ago | Jun 22, 2024 9:17 PM",Piece of mind with Google photos cloud backup of your family memories. Everyone loves the photo memories. We use timers while cooking and on-demand music most everyday.,Rated 5 out of 5 stars
Ronnie,"2 months ago | Jun 21, 2024 10:57 AM",Great product! This integrates well with all my other home smart devices.,Rated 5 out of 5 stars
BBKK,"2 months ago | Jun 17, 2024 4:08 PM","It was great after getting it set up but when the electricity flickers, you have to reset everything again.  It is very frustrating to have to spend that much time and effort over and over.  It should have a battery backup to store the settings.  We went back to our other brand.",Rated 3 out of 5 stars
Anonymous,"2 months ago | Jun 17, 2024 7:46 AM",Prefect addition to my kitchen counter; helps the family stay on task with all the features,Rated 4 out of 5 stars
SimpDaddy,"2 months ago | Jun 15, 2024 8:20 PM","Great addition to my Google home ensemble.  Greets me in the morning, helps with recipes, lists and conversion. Keeps me current on sports, news, & weather. The cam increases home security and my kiddo uses it as another tv/tablet, while I use it for cooking tunes.",Rated 5 out of 5 stars
JasonJ,"2 months ago | Jun 15, 2024 1:33 PM",Great product.... easy to set up lots of options to use.,Rated 5 out of 5 stars
ChanteC,"2 months ago | Jun 14, 2024 10:11 PM",After family member had one and I liked the size of the screen and camera made it more exciting to buy,Rated 5 out of 5 stars
Greenbarrel,"2 months ago | Jun 10, 2024 5:10 PM",I enjoy the speaker quality for music or videos. Its a bit annoying having the Google Home and Nest app for one device.,Rated 4 out of 5 stars
Ralph,"3 months ago | Jun 7, 2024 6:51 PM",Amazing picture quality and all the things we can do. We had the 7in but had to be with the Hub. Larger and easier to see from a distance. Great job Google.,Rated 5 out of 5 stars
TCPJR,"3 months ago | Jun 7, 2024 5:53 PM",Great sound. Great addition for a connected home. Seeing all my photos is nice as well. Connecting to my nest video door bell shows me who is at the door in upstairs bedroom. Easy to set up.,Rated 5 out of 5 stars
MargaritoG,"3 months ago | Jun 7, 2024 4:04 PM",I love this device I use it a lot in my kitchen as I'm cooking,Rated 5 out of 5 stars
MsRuby,"3 months ago | Jun 6, 2024 2:24 PM","I have the smaller one in my bedroom. I love that I can see the cameras, especially the front doorbell, if expecting a package.",Rated 5 out of 5 stars
Carly,"3 months ago | Jun 5, 2024 11:11 PM","I bought this smart Display so that I could have video chats with my nephew and his family. It is easy to set up and easy to use. I love being able to talk to my family whenever they have time to talk. The picture quality and the sound are good, and I’m glad to have it to make it easier to communicate.",Rated 5 out of 5 stars
Miguez,"3 months ago | Jun 4, 2024 12:55 PM","Replacing my old lenovo screen, this one is so much better acreen and sound quality",Rated 5 out of 5 stars
v3rd3drag0n,"3 months ago | Jun 3, 2024 10:54 AM",Great HUB to display and monitor an the APP is useful to make calls to the HUB an see the person clearly.,Rated 5 out of 5 stars
MattA,"3 months ago | Jun 1, 2024 8:39 PM","I got this item after purchasing several google home cameras, a google nest thermostat and a google nest doorbell. It is customizable with pictures and the google voice assitant. It is great for hands free voice commands and even has the option for video calls. The only option for videocalls is through google duos though and my only critique is that it doesnt offer any other option for videocalls, like facebook messenger, because barely anyone uses google duos. It also has much better sound quality than I expected and at max volume can be heard anywhere in my 1500 sqft home. The coolest feature, in my opinion, is that it was say who is at your door based on the saved faces in the google app. It will also show you the doorbell video when someone rings it so you dont have to pull it up on your phone and can use the microphone feature from the hub. Its also touch screen so you dont need to use voice commands all the time. I use it mainly for pulling up YouTube videos or playing music on Spotify while I cook or clean because i have it placed on the counter of my kitchen. I think the price is about $50 higher than it should be but if you have spare cash and lots of google home devices(or devices that work with google assistant) it is worth getting as a way of bring you google devices together with a hands free control hub.",Rated 5 out of 5 stars
MiguelV,"3 months ago | Jun 1, 2024 7:36 AM",We upgraded from the Ale** and we couldnt be happier.,Rated 5 out of 5 stars
HariB,"3 months ago | May 31, 2024 1:59 PM",Not bad at all so it’s about you guys like to buy and test it.,Rated 3 out of 5 stars
Dibyendu,"3 months ago | May 28, 2024 1:37 AM",Great purchase! Easy to sync with google photoes and nest doorbell camera to check on who is outside.,Rated 5 out of 5 stars
Crystal,"3 months ago | May 25, 2024 12:27 PM","Do not buy this if you are replacing your Alexa. It struggles to handle the most basic tasks. No amount of retraining has enabled it to consistently recognize my voice. Accounts don’t cross, so only one person can add things to the grocery list. It just randomly disconnects from apps. Save your money.",Rated 1 out of 5 stars
KrisMatsu,"3 months ago | May 25, 2024 10:22 AM",￼ we replaced our Alexa with this device and it has been a game changer. The screen size alone makes a huge difference as you can see it from across the kitchen. This device is been more compatible with my other smart devices.,Rated 5 out of 5 stars
JayS,"3 months ago | May 25, 2024 5:21 AM",Honestly an amazing product. Would recommend to anyone looking at a nest system,Rated 5 out of 5 stars
Roger,"3 months ago | May 24, 2024 3:19 PM",Best nest hub you can get! This device does just about everything,Rated 5 out of 5 stars
Jain,"3 months ago | May 22, 2024 9:27 PM","Excellent product! Love it, I made my entire home very smart using this HUB.",Rated 5 out of 5 stars
NicoleB,"3 months ago | May 22, 2024 7:48 AM","My son asked for this for Christmas.  He was moving out and wanted the step-by-step cooking instructions.  I use mine all the time for that.  Unfortunately a recent update with Google Assistant the recipes, cookbook and step-by-step cooking directions are no longer a feature.  The Alexa display has better features if you are looking for interactions and music.",Rated 1 out of 5 stars
OldMan45,"3 months ago | May 21, 2024 6:04 AM","My family and I like this a lot! It's great for music and helping us keep up with our calendar. The only thing I would say needs improvement is speaker. It needs just a bit more sub bass. Now, it isn't terrible by any means, I'm just a bit of an audiophile. Nonetheless, great product!",Rated 4 out of 5 stars
Tadeo,"3 months ago | May 20, 2024 6:50 AM",Super useful gadget .. I installed at kitchen .. and my wife love it,Rated 5 out of 5 stars
Tbenson814,"3 months ago | May 17, 2024 6:10 PM",The first generation Google Hub has been successfully replaced with a new model. The upgraded device offers a superior display and seamlessly integrates with my existing system.,Rated 4 out of 5 stars
RuelJ,"3 months ago | May 17, 2024 5:37 PM","A very useful gadget, very nice to give as a gift to a family member or friends.",Rated 5 out of 5 stars
HowardN,"3 months ago | May 10, 2024 5:54 PM","We recently added two Nest Hub Max Smart Displays with Google Assistant to our home, and we couldn't be happier. The charcoal color seamlessly integrates with our decor, while its array of features make it an essential part of our daily routine. With Google Assistant built-in, it effortlessly assists with tasks, answers questions, and controls our smart home devices. The large display is crisp and vibrant, perfect for watching videos or checking the weather. Its intuitive interface and responsive touch controls make navigation a breeze. Overall, the Nest Hub Max enhances our home with its versatility and convenience. Highly recommended for anyone looking to elevate their smart home experience.",Rated 5 out of 5 stars
GloriaM,"4 months ago | May 10, 2024 3:08 AM",I use my Google hub everyday! I love just being able to ask it questions and it notifying me when people are at my door,Rated 5 out of 5 stars
Highdef,"4 months ago | May 9, 2024 9:38 AM","Got this as a gift for family and they loved it, have had no issues setting up and using",Rated 5 out of 5 stars
Mona,"4 months ago | May 8, 2024 9:36 PM",It’s amazing i love it i watch tv on it and play all my music,Rated 5 out of 5 stars
Arturo,"4 months ago | May 7, 2024 9:18 PM",The Google Nest Hub max is the best google assistant.,Rated 5 out of 5 stars
Dsaint,"4 months ago | May 7, 2024 2:15 PM",Work the way it is designed and better yet if you have the nest doorbells,Rated 5 out of 5 stars
MustafaS,"4 months ago | May 7, 2024 2:28 AM","great speaker and display, very useful in the kitchen",Rated 5 out of 5 stars
Korylee88,"4 months ago | May 4, 2024 9:52 PM",Love this device! The graphics are great and sound quality is amazing.,Rated 5 out of 5 stars
Sony1234,"4 months ago | May 3, 2024 3:53 PM",Love the big screen. Upgraded from the 7” nest hub.,Rated 5 out of 5 stars
Angela,"4 months ago | May 2, 2024 9:32 PM",My parents have one and I loved it love where they placed it in the kitchen so I went and bought me one and it is also in the kitchen easy access easy to use I love it I love it I will recommend it to you more hey Google,Rated 5 out of 5 stars
Bryant,"4 months ago | Apr 28, 2024 8:35 PM","Mostly great. 

The docking station should be a standalone Wi-Fi speaker... But it's not.

The docking station could also use some double sided tape or more weight. Taking the tablet off usually just lifts the docking station with it.

Needs to support more apps through. Starbucks isn't available on it. 

Otherwise, good little tablet.",Rated 4 out of 5 stars
Anonymous,"4 months ago | Apr 28, 2024 4:11 PM","Google Home is the best way for families to see each other and stay in contact with nothing more than the touch of a ""video call"" button.  Our Google Home allows all 14 family members to see each other weekly, check on older parents, chat with siblings, children and grandchildren. This has helped keep our family close over long distances.  Google Home is a great gift to give to others and you yourself!",Rated 5 out of 5 stars
GabyG,"4 months ago | Apr 27, 2024 7:21 AM","Great for home control and media
Good sound and image",Rated 5 out of 5 stars
JayC,"4 months ago | Apr 20, 2024 9:31 PM",pretty helpful use it to track sleep. great voice assistant.,Rated 4 out of 5 stars
BrandonF,"4 months ago | Apr 19, 2024 5:36 PM",Wife loves it in the kitchen for cooking videos and listening to music,Rated 5 out of 5 stars
Ricardo,"4 months ago | Apr 19, 2024 5:28 PM",Very good device.  Great screen.  Wish it had a battery though!,Rated 5 out of 5 stars
Skit,"4 months ago | Apr 19, 2024 4:08 PM",Great product good service will recommend to next person love best buy,Rated 5 out of 5 stars
Thomry,"4 months ago | Apr 19, 2024 3:41 PM","Works well, as intended.  Easy to to install. The price was reasonable for a device that merge well with te already google ecosystem had in the home",Rated 5 out of 5 stars
jerro,"4 months ago | Apr 19, 2024 3:18 PM",works great.easy to use ===========================,Rated 5 out of 5 stars
YolandaH,"4 months ago | Apr 18, 2024 6:52 PM","Purchased for my parents, they are now able to see their grandchildren. They love it!!!",Rated 5 out of 5 stars
Patches,"4 months ago | Apr 18, 2024 8:41 AM","This is great for watching shows while cooking, looking a recipes, and just using for general questions.",Rated 5 out of 5 stars
SarahT,"4 months ago | Apr 16, 2024 10:21 PM",Decent for just a hub but lacks alot of simple features. I recommend speeding the extra money on the Pixel Tablet.,Rated 3 out of 5 stars
VictoriaJ,"4 months ago | Apr 16, 2024 8:25 PM","We did not understand that this device does not work with z wave devices, so that was a disappointment.  Otherwise it is fine.",Rated 3 out of 5 stars
Chadjamesdrone,"4 months ago | Apr 15, 2024 11:18 PM","This will make an excellent addition to any Google Home device you want, and you can use voice commands on it as well. You don’t even have to touch a screen. This will make a welcome addition to any smart home. And if you are one of those high-tech people, it would be a good idea to put one in each room so anybody can call each other from room to room instead of yelling across the house. It’s nice that I can ask it to pull up the doorbell, and it does it automatically. This will make a welcome addition to any smart home. And if you are one of those people who are high-tech, it would be a good idea to put one in each room so anybody can call each other from room to room instead of yelling across the house ￼",Rated 5 out of 5 stars
Anonymous,"4 months ago | Apr 12, 2024 4:27 PM",I tried this product for the camera to secure my home. There is no night vision and the home screen doesnt lock for my use only. The voice control is only supposed to work with my voice but it still allowes everyone in the home to use it. This my work for someone else.,Rated 2 out of 5 stars
TALLGUY,"4 months ago | Apr 12, 2024 3:31 PM",I support the Google Nest Series. I own almost all the models for my home. 5 stars here,Rated 5 out of 5 stars
Toni,"5 months ago | Apr 8, 2024 8:32 AM",Device is ok but the camera feature doesn’t work. We always have issues with it staying connected and the only way to fix it is to remove and add to my google account.,Rated 2 out of 5 stars
JuliaJ,"5 months ago | Apr 6, 2024 12:09 AM",My favorite thing from google! Use it several times a day,Rated 4 out of 5 stars
DennisB,"5 months ago | Apr 5, 2024 1:41 PM",It's quite helpful and easy to use. We use it in the kitchen to quickly look up recipes.,Rated 5 out of 5 stars
Electronics,"5 months ago | Mar 31, 2024 8:16 PM","The product quality is consistently outstanding, exceeding my expectations every time.",Rated 5 out of 5 stars
EdwinG,"5 months ago | Mar 22, 2024 7:45 PM","Need to be more open to install new apps, after that a good product.",Rated 4 out of 5 stars
teers4,"5 months ago | Mar 22, 2024 5:20 PM","Speaker isn't the best, but it's also not really meant to rock the house.  Ease of connection is terrific and the functionality has been excellent thus far.",Rated 5 out of 5 stars
TatianaB,"5 months ago | Mar 22, 2024 4:19 PM",I love all the google products! High recommend this item!,Rated 5 out of 5 stars
AlGagnon,"5 months ago | Mar 22, 2024 3:57 PM",Added to our system and now have a more full networked system with 4 smaller ones throughout the house.,Rated 5 out of 5 stars
Great,"5 months ago | Mar 22, 2024 3:53 PM","I own 3 of these becauce I am enjoy them so much, I highly recommend them",Rated 5 out of 5 stars
DetFlyer,"5 months ago | Mar 18, 2024 10:14 AM","Easy to setup. I love not having to pull out a recipe, it's faster to just ask Google. I would recommend it to friends and family.",Rated 5 out of 5 stars
DontBuyIt,"5 months ago | Mar 16, 2024 11:18 AM",Screen failing after 2 years. Avoid this product and don't waste your money.,Rated 1 out of 5 stars
MariaS,"5 months ago | Mar 16, 2024 6:15 AM","Really nice having this in your living room. If you're going to buy a display, get one with a camera.",Rated 5 out of 5 stars
cyber2steve,"5 months ago | Mar 16, 2024 2:48 AM","This is my 6th Google Max Hub. I like them so much I also give them out as gift to my family members and this one to a close friend...  It's a nice size screen,  it acts as a picture frame with slide shows of my photos, I watch online medias and ask Google to show me my security cameras and adjust smart home devices... It's always a good buy...",Rated 5 out of 5 stars
Goodsounds,"5 months ago | Mar 15, 2024 6:45 PM",Nice sound and picture quality. There are a lot of different functions which make life easier for a person with disabilities,Rated 5 out of 5 stars
JoeaS,"5 months ago | Mar 15, 2024 4:31 PM","Great unit, image quality is excellent!! setup took a little patience but overall a great product.",Rated 5 out of 5 stars
MatthewC,"5 months ago | Mar 15, 2024 3:48 PM",We started our smart home journey when we learned that our new home security/monitor system works with Google Nest. We literally have 4 of these thing for different rooms. Only recently discovered our climate control works with it too and its not even a Google Nest Thermostat. We find the whole system useful but we are still building and having fun at the same time.,Rated 5 out of 5 stars
T1NM4N,"5 months ago | Mar 13, 2024 3:27 PM","Works great, can do everything I do on my Google home app on my phone and more. I have it on my work desk, and can easily check my Google camera to check on my baby, play spotify, and cast other apps as well.",Rated 5 out of 5 stars
DanB,"5 months ago | Mar 12, 2024 4:19 PM","Good, but a bit problematic with SlingTV. I would say a good buy overall.",Rated 4 out of 5 stars
MorleyD,"5 months ago | Mar 11, 2024 10:10 PM","I LOVE my NHM! I have it near my TV and honestly, I sometimes watch it more than the TV. The images that scroll by are great to see.  The sound is excellent, very clear. It doesn't take up a lot of space. I do wish the screen was more vertical, especially when I check on the house when we are away. I show it off and now everyone who sees it, wants one. I'll be getting one for my mom and my mother-in-law....because they both love it!",Rated 5 out of 5 stars
