Profile Name,Date,Data,Star
M. Yates,"Reviewed in the United States on June 19, 2022","I moved to the East coast last December. We have a six-zone boiler heating system with baseboard heaters throughout 4,200 sq. ft., on three floors (not bragging, just trying to give an idea of the size and complexity of the system). With six old-school manual thermostats spread throughout the house, it was nearly impossible to evenly regulate the heat during the cold winter, so some rooms were very cold and others too warm. I found myself constantly going up and down stairs to monitor temperatures and make sure I wasn't wasting heat or keeping areas too cold that would affect other zones.

My boiler was installed in 2007, so it isn't very old and it's very efficient. However, it's a two-wire system with no C-wire, so the fact that 99.9% of ""smart"" thermostats on the market require a C-wire to operate was very frustrating.

I stumbled across the Emerson ST55 and saw in the description that it could work either with or without a C-wire, so I called Emerson tech support to make sure before I plunked down hundreds of dollars on six thermostats that might not work. Tech support confirmed my fears that it would not work without a C-wire despite the Amazon description, so I kept hunting.

Fortunately I found a YouTube review of the ST55 and the owner said he had been successfully using it with the same kind of two-wire system that I have for over two years. So I figured I'd buy one and see if it worked. Worst case, I'd send it back for a refund.

The instructions inside the box clearly state that it will not work without a C-wire, but I ignored them and kept going. With only two wires it was a breeze to install. I put in the batteries, snapped it into the wall plate, downloaded the app, created an account and was ready for testing in about 15 minutes.

I'm not sure if it's just my system or all boilers, but I didn't realize it doesn't turn on instantly when the thermostat temperature is raised above the existing temperature. So when I first tested it, I was bummed that it didn't work. But as I walked downstairs to the boiler, it was running! So I did some more testing, and found that there's about a 20-25 second delay between increasing the temp and the boiler kicking in.

Granted it's only been a couple months since I got it, but I've played with it plenty and it's working great. Instead of a C-wire, the thermostat is powered by two AA batteries. The guy in the video said he's been using the same regular alkaline batteries for two years and they're still at 90% charge capacity, which is awesome. But I figure that even if I have to replace batteries every year, 12 AA batteries is a helluva lot cheaper than paying an electrician to rewire all six zones!

On top of the six heat zones, I also have two central AC units. Thankfully those have C-wires, but I'm going to replace those thermostats with the Emerson ST55 also so that I'll have full control of all heating and cooling from one simple-to-use app. With any luck it'll go on sale on Prime Day so that I can save some money! :-)

I can't speak to the Alexa integration as I don't use that functionality. But plenty of other reviewers have said it works fine.

I appreciate Emerson's thoughtfulness in adding a built-in level to the back plate. I'm a stickler about things being mounted straight, so it was nice to not have to break out a level to make sure I didn't mount it crooked.

As for aesthetics, the ST55 is nice. It's not too large to look obnoxious, but it has a good-sized display. And I'm not sure if it's just because I'm running it on battery, but the back light doesn't stay on constantly, so it doesn't light up a dark room at night (not too important in common areas, but important if you've got a thermostat in a bedroom).

So, to make a long story short, don't believe Emerson. This thing really does work on a two-wire boiler heat system with no need for a C-wire!",5.0 out of 5 stars
James W.,"Reviewed in the United States on December 11, 2020","(Long, but I hope worth the read) Overall, I am extremely happy with the Emerson Sensi smart thermostat. For me it was a pretty easy project, but it is important that you know what type of cooling/heating system you have prior to attempting the installation. Although the basic installation is made very simple using the Sensi app, there were some very important things not covered. I suggest you check out how to configure your Sensi on their site (Configuring Thermostat | Sensi US (emerson.com)). I’m a pretty good DIYer, but have very little experience with AC/heating systems. I was 99% sure I had a heat pump setup, but I called a local AC technician I know to confirm and am glad I did. Having installed a few smart thermostats, to include this one, he not only confirmed I had a heat pump, he also informed me I would have to go into the system settings on the thermostat and change the outside setting from ‘AC1’ to ‘HP1’. This was confirmed when I checked out the Sensi website. Armed with this information, installation went without a hitch and I was up and running in no time.
Pros:
- Easy to install, if you have a little DIY experience, all the information needed concerning your AC/Heating system and gather the additional information before starting.
- Very easy to connect to WiFi and integrate with Google Home. Connected to my WiFi with in seconds following the instructions; when I opened my Google Home app, there was an icon to add Sensi, clicked on it and moved the thermostat to the appropriate room. I have not experienced any drop-offs or loss of the WiFi, even when I turned off my WiFi for a few hours, removed the batters or installed old, weak batteries as tests; in every case, the thermostat remained connected or automatically connected right back up in seconds with no need to go through the WiFi setup operations again.
- The Sensi app, in addition to walking you through the installation, allows you to set up various cooling/heating programs to run automatically, as well as change other settings. Once added to Google Home, you can switch programs (cool, heat, auto), turn it on/off and set the temp. You can also use voice commands through Google to do this as well.
- The ability to adjust the thermostat to compensate for temperature offsets. In my case, where my thermostat is located the temp registers about 3 degrees off from what it is in our master bedroom or living room. I simply adjusted the offset in the Sensi app to compensate for this and now our bedroom and living room remain closer to the set temp then they have in the past.
- It can be operated manually by those less tech savvy. The controls on the face plate look and operate like those on our old ‘conventional’ one. I also like that you can lock out the manual operation from the app so that no one else can mess with the settings; like during the holidays when you have family members over who feel they can change the settings without asking .. lol.
- Being able to adjust the system cycling rates. There are three settings (short, medium, and long) that can be set independently for heat, heat aux and cooling. I don’t mind having my temps vary a degree before the system cycles back on, so I have all mine set to long; during the summer, I may switch cooling to short to see how much of a difference it makes.

Con: I only have one and it is the reason for my 4 rating. The instructions, at least those in the box, should include information on the additional settings that may need to be needed depending on the AC/heating system you have. At a minimum, they should inform you that you may need to make additional setting changes and where to find the instructions online.",5.0 out of 5 stars
Richard,"Reviewed in the United States on August 5, 2018","Purchased this model based on the good reviews and the no requirement for a c-wire. Decided to replace my 17-year old RobertShaw thermostat (t-stat) because I wanted remote capability. I was hesitant to touch A/C wiring whereas I had no experience with A/C wiring. The A/C company wanted $90.00 to install it, but I decided to do it myself since it was just a 4-wire system. (no c-wire). It took me just 15 min to remove the old, and then install/wire up the new t-stat. That's how easy it was. Was able connect the t-stat to my 2Ghz wifi network and used the Sensi app on my mobile. Everything worked just fine. No issues at all with wifi setup and using the app. It works exactly as designed.
You can make t-stats adjustments either by wifi or LTE on your mobile. No delay in signal. My wifi has never lost signal and has stayed up now for 1 week.

The t-stat itself (on wall) has very few settings. Just has temp control, fan/auto/heat/cool and wifi settings. All other settings are done via your mobile. There is also a light switch at the top of the t-stat that when pressed, stays on for 10 seconds, then turns off. BTW: The t-stat light is always off until you press any button. LCD screen is very easy to read with or without the light.

One of my requirements for a t-stat was to have a differential as to how much longer a unit will run once it hits its set temp. This model does not have a adjustable value, but does have a ""cycle rate"" of slow/medium/fast. I set mine to slow to keep it from turning on/off too many times. From the measurements I have taken with a infrared thermometer, the ""slow"" cycle has a differential of 0.7 degrees. This seems to be inline with what Emerson says (actually, they say within 1 degree).

Important note: If your home loses internet access, you will NOT be able to control the t-stat, even when you are at home on your local intranet. Some systems still let you access your devices via the local intranet, but this t-stat require cloud access 24x7.
Now, in case your t-stat screen is locked, and you lose internet connection, you have no way to do any changes on the wall unit since the screen is locked and your mobile is the only way to unlock it. In this case, Emerson has a key sequence you can press on the wall unit to unlock the display. (btw: the screen lock is a feature that you enable on the t-stat to prevent people from making changes on the wall unit)

Small issues:
The light switch at the top of the t-stat is hard to find and press. I never hit it on the first attempt. Always have to feel around at the top and press hard.

There is one problem I constantly hit. I goto my Sensi app and change any setting (temp, lock/unlock screen). The Sensi app accepts the setting changes, so you think all is good. However, when I look at the t-stat on the wall, no changes occurred (see attached picture). This has happened numerous times each day since I have had it. Called support and they are not aware of any issues. In each failure, my wifi signal is up - no problems with wifi.
After a few days of this happening, I see the problem. It does not appear to be the t-stat, but rather the Sensi app itself. It somehow is hung up, but gives the appearance that it is operating. If I kill the app, and restart it, the sync up to the t-stat is working again. Each time that the app behaves this way, I just kill and restart it. Works every time. So, each time I use the app to make a setting change, i just kill the app and restart when I need it.

The accuracy of the t-stat is pretty accurate (within 0.5 degrees of my infrared thermometer)

Overall, love the product. I can easily control my t-stats from my mobile or directly from the wall. Makes life very easy now. BTW: Works great with Google Assistant. I use my Android phone to adjust temperature settings (i.e. Hey Google: Set the temperature to 70 degrees"")

Update: 12/10/18:
Product has worked flawlessly. No issues at all with wifi connectivity. Never had a dropped connection. Both wifi and 4G LTE connections always connect just fine. When making thermostat changes on your cell phone (wifi or 4G LTE), changes take effect within a couple seconds. Also, the problem mentioned above regarding the app freezing when your cell gets out of sleep mode, this has been fixed a while ago in an updated Sensi app. All around, everything works great. Love this product - makes it very convenient to remotely control your AC.

Update: 3/1/2020
Everything has worked flawless. Still have original Energizer AA batteries (full bars). Never had any LTE/Wifi connectivity issues.

Update: 4/2/2021: Not a single problem. Works flawlessly.",4.0 out of 5 stars
Jim & Renae,"Reviewed in the United States on July 19, 2019","We wanted a new thermostat for several reasons. The old Honeywell was working fine but it had several deficiencies. First, it was too easy for our grandson to change the settings. And the display was hard to read unless you stooped right in front of it. And the programming was a nuisance.

Searching for a thermostat with screen lockout we discovered that none of the good ole Honeywell residential thermostats have this feature. So we moved-on to almost-as-good - almost-as-old Emerson which has this feature on most of their residential products. Out utility company offers a $25 rebate on programmable thermostats and a $100 rebate on WiFi thermostats. With a Prime Day price of $75 this thermostat is basically free. However we were concerned by all the complaints about setup and network problems. So here is what we found.

The good -

1) Excellent manual controls and screen visibility, copied from the refined design of the legacy Emerson line. Most other WiFi thermostats have too much screen clutter in the attempt to eliminate buttons. Old-fashioned buttons really are better for the most common functions even if they don't look stylish.

2) You can control almost anything you want from your smart phone - after you complete setup.

3) You can configure this thermostat to work with almost any kind of HVAC system.

4) You have plenty of flexibility to create multiple programs with as many or as few schedule steps as you wish. For example you can have separate schedules for when you are home, when you are gone temporarily, when you are gone for months at a time. Some reviewers have complained about the difficulty of programming your schedule. Maybe Sensi have improved the app, but I found it reasonably easy to program, given the flexibility.

The bad -

1) The WiFi setup is very finicky. Were I not an engineer with many years of experience with communications equipment I might well have floundered. Common security features in WiFi routers can defeat your efforts. I would note that I recently installed a smart sprinkler controller that is completely programmed from my smart phone and has full remote access capability. WiFi setup was a breeze. I did not have to touch my WiFi router configuration at all. Sensi could do a lot better.

2) The manuals. Yes Sensi, some people do read manuals. Once you get past the simpleton stuff yours are rather poor. ""See the App"" (which has limited help on some topics) is not a good answer. Things like a list of the menu options and what they do - would be very helpful. The other Emerson thermostats have good manuals - so should yours.

3) Don't bother to call Sensi tech support. You will spend a lot of time on-hold and you might never actually talk to a human. And the support web site was almost as slow. The information is there but you have to be a pro to understand the more detailed stuff. Sensi needs to beef-up their tech support and/or produce a good tutorial on how to connect to a WiFi network. And if they had to write a good tutorial, they might improve their software to make things easier for their customers.

4) I found it necessary to change almost every default setting. Many of the complaints about the performance of this thermostat, arise from not bothering to check every last setting in the app. Better defaults would result in fewer complaints. This problem is confounded by lack of a list of menus and options in the user manuals. If you do not browse carefully through the app, you might miss the setting that you find most annoying.

5) You can control virtually everything else but not the fan schedule. A simple ""Fan On or Auto"" check box in each schedule step would be great.

The gory details -

If you have read this far, you might want to benefit from some of my experience setting-up this device for my network.

1) First let me explain my network setup. Basically my network has a less-trusted domain and a more-trusted domain. In the less-trusted domain sit my smart TVs, Game controllers, a laser printer that anyone can use, VoIP and media gateways, smart home sprinkler and thermostat controllers, etc. In the more-trusted domain sit my server, laptops, a color laser printer, and a very few other devices.

2) Between my cable modem and my less-trusted domain sits a simple but bullet-proof Ubiquity firewall router/switch. Hanging-off the Ubiquity switch in the less-trusted domain, are a VoIP gateway, a WiFi router/switch, a printer and a guest Ethernet port.

3) The WiFi router/switch serves as a second firewall between the less-trusted and the more-trusted domains. The WiFi hub has both 2.4 GHz and 5 GHz channels, with separate private and guest access, for a total of 4 SSIDs. The router steers the guest SSIDs to the less-trusted domain and the private SSIDs to the more-trusted domain. The private and guest SSIDs have different WiFi access codes (passwords) so both domains are ""secure"" (in the WiFi sense).

4) By default the guest WiFi clients cannot see each other on the less-trusted domain. This is a common security feature in WiFi routers that support guest access. And it is one of the features that trips-up installation of the Sensi thermostat, but not my smart sprinkler controller.

5) Observing the network interaction between the Sensi app on my smart phone, the Sensi thermostat on the wall, and my WiFi router, at some times the app and the thermostat are operating point-to-point over the WiFi and sometime via the router. So-far so-good. This is expected behavior. However some of the router traffic uses LAN (Layer 2) addresses and some uses IP (Layer 3) addresses. This mixture can mess things up if the network is not configured exactly as the Sensi software developers expected.

6) Sensi should test with other common network configurations. As I mentioned my brand X sprinkler controller does not suffer from these peculiarities. If Sensi invested more money on software engineering and testing with different network configurations they could save a bundle on support costs and customer returns.

My recommendations -

1) Configure your smart phone to use the same WiFi SSID that you want to use for your Sensi thermostat.

2) Be sure this SSID is only available for 2.4 GHz.

3) Go through your router settings to ensure that every WiFi client of this SSID has unrestricted (LAN as well as IP) access to every other client of this SSID.

4) Run the Sensi app through the complete installation and registration process.

5) After everything is working you can restore your normal network configuration in your router and smart phone. Do not change the SSID for the thermostat.

6) If you need to change the SSID for the thermostat later, go back to start. Reset your thermostat and reconfigure your network. Rinse thoroughly and repeat as often as necessary.",4.0 out of 5 stars
Jennie,"Reviewed in the United States on August 11, 2024","Could only connect wifi once. Got a new wifi router for home and tried to set Sensi thermostat using the sames steps as I did before. However, this time around, the Sensi app would not go to next screen once my phone connected to Sensi's wifi. Did many of the troubleshooting steps as researched (instatlled brand new battery for thermostat, ""rebooted"" thermostat, restarted phone, changed phone's wifi settings, etc.) but to no avail. Now, the thermostat is now just a dumb thermo. Had good potential. If app issue gets fixed, this would be a 5 star.

UPDATE: I was able to reconnect the Sensi thermostat. In my original negative post, I tried reconnecting to new home wifi using a different account email address and a different phone. I eventually discovered that if I log in with the app on the original set-up phone and email address, the app would work. Only thing I would have liked is if Sensi would put a warning to use original email address for account login and phone. I recently read this as a potential fix in one of the Amazon's reviews (I hadn't seen this fix in my earlier research). With the app now working and me being able to check on the temperature setting remotely, this thermostat is an easy 5 stars. The additional options in the app such as setting offsets, cycle rates, a/c protection, et. are just great! I have no c-wire so I use a battery, but it is also great that Sensi provides on their website how to wire for a c-wire (without c-wire adapter) by using a jumper but they provide how to install a c-wire adapter so this thermostat give folks few options. I have central a/c and propane gas heater with no c-wire and the Sensi works for my configuration. I will eventually try to wire using a jumper to set-up a ""mock"" c-wire.",5.0 out of 5 stars
Shorebilly,"Reviewed in the United States on August 19, 2024","As soon as we opened the box & saw the tags for the wires, we knew it was going to take awhile to install this & that we would need tech support. Our Lennox system is quite old & only 4 of 8 wires matched the Sensi unit. We called tech support & spoke with Rose who was fantastic. We emailed a pic of our setup to her. She asked that we hold for approx 5-7min. We had to take the panel off of the air handler to look for additional wiring, which didn’t help much. After we clarified that the black wire on our Lennox thermostat was labeled R, not B, Rose was able to confirm what our new wiring arrangement should be. She also helped us reprogram our Sensi thermostat for the new wiring configuration. At that point, the rest was a piece of cake. We were very impressed with the level of knowledge & support provided. The unit works & looks great. Very satisfied & happy with our purchase.",5.0 out of 5 stars
Ronald G. Parker,"Reviewed in the United States on August 31, 2024","I’m very satisfied with my purchase of a Sensi smart thermostat. I have a dual heat system, and didn’t think a smart thermostat would work properly with my rather old heat pump and natural gas furnace. It turns out I could replace my malfunctioning original thermostat with one that I can program and control at a distance with my iPhone. It works great! I contacted customer service two times with a question, one regarding installation and the other regarding controlling heat pump and gas furnace operation. Both resulted in my getting exactly the information that I needed. Couldn’t be more pleased with this product, instructions provided, and customer service!",5.0 out of 5 stars
TG,"Reviewed in the United States on September 2, 2024","Once I figured out the wiring it worked well. Easy to connect to Wifi and the Sensi app is simple and easy to use.

One issue I had: the thermometer reports a room temperature that's 2 degrees below the actual temperature (as measured against multiple other digital and mercury thermometers). The settings allows you to create an offset for the reported room temp, however, so I offset it by 2 degrees and it works fine. But that shouldn't be necessary. This one issue made me give it a 4 instead of a 5.",4.0 out of 5 stars
Brewer W Leggett,"Reviewed in the United States on July 10, 2024","Many 2.4 Ghz devices are network picky, especially initial setup. Personally 25 years plus network engineering, conventional networks to broadband to wifi to mesh- no worries.

First in dumb mode the thermostat works quite nicely, wifi setup - not so much. The mini-setup guide is not very informative and no trouble shooting recommendations. Called tech support around 1:45 pm EDT and waited 49 minutes to recorded tips, no one answered. Customer support SHOULD publish hours phones are manned and SHOULD have a call back feature added to their customer service number. My HVAC home contractor uses one and he only covers two counties.

There were help/tips available on several parts of the vendors website, but you had to be diligent when looking. Bottom line, I performed all available troubleshooting steps with no success in connecting to SENSI XXXXX network. Ran setup process fron Sensi app more than 30 times over three hours without success.

Please reach out before I pack up this thing and send it back.

A Noid.

2ND Comment:

Searching Sensi web site found ANOTHER list of things to try. Last suggestion was use a different device, so I used my tablet that isn't nearly as smartphone. Downloaded app, logged in and same steps in the guide worked immediately!

Cool beans.

No longer A. Noid.",5.0 out of 5 stars
LJP,"Reviewed in the United States on August 17, 2024","First, these were super easy to install. Took me less than 15 minutes per thermostat. Second, I got a rebate from my power company for installing these. Third, I absolutely love controlling them from my phone. If I leave it too cool when I leave home, I can adjust it once I remember. My teenage daughter loves adjusting the temperature upstairs from her phone while in bed rather than having to walk down the hall. Temps are much more accurate than my previous thermostats. I highly recommend these! I bought a different one at first, but it wasn’t compatible and I had to return it.",5.0 out of 5 stars
