Profile Name,Date,Data,Star
Brandi,"Reviewed in the United States on July 18, 2020","We've had this thermostat a month and I really like it so far. It makes me think our old thermostat wasn't actually working for a long time before it started setting itself to 85°. Since it wasn't even programmable, I knew it had to go and if I was going to upgrade I may as well go with something just a bit more...modern than a set-temp-and-it-stays-unless-you-change-it thermostat. I'm going to do pros and cons below. I do want to say, I took my old thermostat off the wall first, wrote down all the wire colors and the letter each was connected to on a piece of paper. The app removes the need for pen and paper. I just used my pen and paper to place the flags mentioned below on the correct wires.

Pros:
1. This thing is super easy to install. Open the box and there are instructions for you to download the Sensi app. Once the app is downloaded it has you choose which letter slots you have wires connected to (R, RH, C, E, OB, etc.). The app then tells you how to use the flags they provide to label the wires. For example I had a wire that went into a slot labeled ""R"", but Sensi only had ""RH"" and ""RC"" (I think it was RC), so the app told me which R my wire needed to go in. Not having any electrical wiring experience, the app was SUPER helpful. It even had you take a picture of your wiring to save to your phone, just in case.

2. The piece that attaches to the wall has a built in level. I am super annoyed when things aren't straight on walls, so this right here, was awesome.

3. The app is really easy to set up. I just have a daytime and nighttime cycle, but I could set up all kinds of things super easily. Vacation modes, turning the AC up when I leave the house... It was great. It even walked me through how to sync the app with my Google assistant and the Samsung Smart Things app, which I didn't end up continuing to use. (See cons #1)

4. The report that tells you how long your AC is running is really helpful as well, especially since we had issues last year with it not being able to keep up. We have better insulation and updated windows and it's nice to see they are working, even when it's 99° with a heat index at 112°. (See cons #2)

5. I like that you can do things like temp and humidity offsets, have the AC turn on to help maintain proper humidity levels (we live in Florida, so this is a big thing for me), change the cycle rate (ended up choosing this one over another brand because people had issues with not being able to adjust the cycle rate on that one), and easily turn heat boost on or off. (See cons #3)

Cons:
1. It doesn't work with Bixby. This is something I don't really understand, but I'm guessing they assume if you're gonna use Bixby you use Smart Things? But I can just use Google for that instead.

2. The recent usage section only shows how long the AC ran that day, not which times it ran or how long at a time it ran. It would be nice to see how long the AC was running at a time, especially in the afternoon when it gets really hot. I have not yet gotten a monthly report since I got the thermostat mid-June and it's now mid-July. Interested to see what the monthly report looks like at the end of the month.

3. Sometimes I had to change settings a couple times before they ""stuck"". I found after changing a setting I needed to wait a few seconds before returning to the settings menu and that helped.

4. Shortly after I got the thermostat the AC drain line clogged. This resulted in my app/thermostat constantly saying cooling was on, but the AC wasn't running. My usage for that day was like 21hrs, but I know it wasn't actually on for the majority of that. Not really a huge issue, but you won't have an accurate reading for that day.

Summary:
Overall, this is a really amazing unit and I have been really glad to have it. It was seriously a breeze to instakl and set up and functions well. I do wish I could connect it to Bixby without using Smart Things and I do wish I had a more detailed daily usage report, but those are very small inconveniences. I normally keep our house at 78° during the day and 77° at night and sometimes that feels cold. I would often feel hot before and wondered if our AC was not working correctly, but it would seem it was actually the thermostat. Very happy with this purchase.",5.0 out of 5 stars
Mister M,"Reviewed in the United States on March 18, 2021","This Sensi thermostat is waaaaaaaaaaay better than Honeywell. The Honeywell software and their mentality is completely OUT OF WACK and their thermostats are pure garbage and it will damage your equipment. The Honeywell Cycle rate is set to about .5+/- so my furnace now in the winter has been running and running nonstop and my furnace was not getting any rest. That is a very bad thing for our heating and A/C system, not to mention the gas and electricity bill. I called Honeywell tech support and they told me that ALL their thermostats have this fixed setting and there is nothing in the menu for us to change that option. Something is really wrong with this Honeywell company and this cycle rate setting is simply inappropriate.

I just installed my new Emerson Smart Sensei and even the WI-FI connectivity process went very smoothly and I successfully connected my new thermostat. The Sensi app takes you thru the entire process fairly quickly and is very easy I have no idea what other people are having problems with. Note that I already knew which cables to connect so if you don't know that's a different story. The Honeywell thermostat on the other hand was a nightmare to install thru the app and it simply doesn't work so I had to go to my desktop PC and finish the process there. Really annoying.

And guess what I found out? The Sensi app itself has the options for me to change the Cycle rates to either SLOW, MEDIUM or FAST that was awesome I could not believe it!!! :-) Sensi was so smart by not putting this option in a hidden menu. Honeywell Engineers and marketing department simply don't know what they are doing. I'm looking forward in seeing how my new Sensi thermostat will perform tonight and I'm sure it won't disappoint. This device looks really great on the wall as well. The Honeywell WI-FI cost me $79 on sale and this Sensi costs more but is TOTALLY worth it!

The only thing I didn't like is that a day before purchasing this device I contacted Sensi tech support and took one entire hour to pick up the phone and someone from the Philippines picked up the phone eventually. This is not acceptable. Other than that I completely recommend this thermostat.

UPDATE: This Emerson Sensi Smart thermostat is definitely a superior product. Only while running it in one day you can see and hear the difference. I set the cycle rate to SLOW and boy what a difference! The thermostat outputs the heat in a very smooth way and when the it reaches the set temperature it stops for several minutes and it DEFINITELY does not restart in 30 seconds like the Honeywell ones. I have no idea what problems others are having that complain saying this thermostat doesn't work but I can tell you that is not the case. The software and hardware is really well made and nice looking as well. I prefer this Sensi to those ugly round looking ""high tech"" and over priced thermostats.",5.0 out of 5 stars
Jim Healy,"Reviewed in the United States on July 22, 2024","The reviews conflict as t whether or not this unit requires a ""C"" wire (Common wire). As stated in the product literature, in my installation, a ""C"" wire WAS NOT required.

Installation to replace a previous thermostat was easy; took all of 15 minutes. WiFi access will be helpful in my installation, and it works well with the app. The app is just a remote interface that's identical to the unit face itself.

A couple of days after installation, I got a warning that the temperature of the room was more than 5 degrees above the set temp. The A/C was running, but not keeping up. Traced that to a clogged air filter, but I appreciated the warning message.

Yes, I recommend this unit for price point and function.",5.0 out of 5 stars
M. Yates,"Reviewed in the United States on June 19, 2022","I moved to the East coast last December. We have a six-zone boiler heating system with baseboard heaters throughout 4,200 sq. ft., on three floors (not bragging, just trying to give an idea of the size and complexity of the system). With six old-school manual thermostats spread throughout the house, it was nearly impossible to evenly regulate the heat during the cold winter, so some rooms were very cold and others too warm. I found myself constantly going up and down stairs to monitor temperatures and make sure I wasn't wasting heat or keeping areas too cold that would affect other zones.

My boiler was installed in 2007, so it isn't very old and it's very efficient. However, it's a two-wire system with no C-wire, so the fact that 99.9% of ""smart"" thermostats on the market require a C-wire to operate was very frustrating.

I stumbled across the Emerson ST55 and saw in the description that it could work either with or without a C-wire, so I called Emerson tech support to make sure before I plunked down hundreds of dollars on six thermostats that might not work. Tech support confirmed my fears that it would not work without a C-wire despite the Amazon description, so I kept hunting.

Fortunately I found a YouTube review of the ST55 and the owner said he had been successfully using it with the same kind of two-wire system that I have for over two years. So I figured I'd buy one and see if it worked. Worst case, I'd send it back for a refund.

The instructions inside the box clearly state that it will not work without a C-wire, but I ignored them and kept going. With only two wires it was a breeze to install. I put in the batteries, snapped it into the wall plate, downloaded the app, created an account and was ready for testing in about 15 minutes.

I'm not sure if it's just my system or all boilers, but I didn't realize it doesn't turn on instantly when the thermostat temperature is raised above the existing temperature. So when I first tested it, I was bummed that it didn't work. But as I walked downstairs to the boiler, it was running! So I did some more testing, and found that there's about a 20-25 second delay between increasing the temp and the boiler kicking in.

Granted it's only been a couple months since I got it, but I've played with it plenty and it's working great. Instead of a C-wire, the thermostat is powered by two AA batteries. The guy in the video said he's been using the same regular alkaline batteries for two years and they're still at 90% charge capacity, which is awesome. But I figure that even if I have to replace batteries every year, 12 AA batteries is a helluva lot cheaper than paying an electrician to rewire all six zones!

On top of the six heat zones, I also have two central AC units. Thankfully those have C-wires, but I'm going to replace those thermostats with the Emerson ST55 also so that I'll have full control of all heating and cooling from one simple-to-use app. With any luck it'll go on sale on Prime Day so that I can save some money! :-)

I can't speak to the Alexa integration as I don't use that functionality. But plenty of other reviewers have said it works fine.

I appreciate Emerson's thoughtfulness in adding a built-in level to the back plate. I'm a stickler about things being mounted straight, so it was nice to not have to break out a level to make sure I didn't mount it crooked.

As for aesthetics, the ST55 is nice. It's not too large to look obnoxious, but it has a good-sized display. And I'm not sure if it's just because I'm running it on battery, but the back light doesn't stay on constantly, so it doesn't light up a dark room at night (not too important in common areas, but important if you've got a thermostat in a bedroom).

So, to make a long story short, don't believe Emerson. This thing really does work on a two-wire boiler heat system with no need for a C-wire!",5.0 out of 5 stars
James W.,"Reviewed in the United States on December 11, 2020","(Long, but I hope worth the read) Overall, I am extremely happy with the Emerson Sensi smart thermostat. For me it was a pretty easy project, but it is important that you know what type of cooling/heating system you have prior to attempting the installation. Although the basic installation is made very simple using the Sensi app, there were some very important things not covered. I suggest you check out how to configure your Sensi on their site (Configuring Thermostat | Sensi US (emerson.com)). I’m a pretty good DIYer, but have very little experience with AC/heating systems. I was 99% sure I had a heat pump setup, but I called a local AC technician I know to confirm and am glad I did. Having installed a few smart thermostats, to include this one, he not only confirmed I had a heat pump, he also informed me I would have to go into the system settings on the thermostat and change the outside setting from ‘AC1’ to ‘HP1’. This was confirmed when I checked out the Sensi website. Armed with this information, installation went without a hitch and I was up and running in no time.
Pros:
- Easy to install, if you have a little DIY experience, all the information needed concerning your AC/Heating system and gather the additional information before starting.
- Very easy to connect to WiFi and integrate with Google Home. Connected to my WiFi with in seconds following the instructions; when I opened my Google Home app, there was an icon to add Sensi, clicked on it and moved the thermostat to the appropriate room. I have not experienced any drop-offs or loss of the WiFi, even when I turned off my WiFi for a few hours, removed the batters or installed old, weak batteries as tests; in every case, the thermostat remained connected or automatically connected right back up in seconds with no need to go through the WiFi setup operations again.
- The Sensi app, in addition to walking you through the installation, allows you to set up various cooling/heating programs to run automatically, as well as change other settings. Once added to Google Home, you can switch programs (cool, heat, auto), turn it on/off and set the temp. You can also use voice commands through Google to do this as well.
- The ability to adjust the thermostat to compensate for temperature offsets. In my case, where my thermostat is located the temp registers about 3 degrees off from what it is in our master bedroom or living room. I simply adjusted the offset in the Sensi app to compensate for this and now our bedroom and living room remain closer to the set temp then they have in the past.
- It can be operated manually by those less tech savvy. The controls on the face plate look and operate like those on our old ‘conventional’ one. I also like that you can lock out the manual operation from the app so that no one else can mess with the settings; like during the holidays when you have family members over who feel they can change the settings without asking .. lol.
- Being able to adjust the system cycling rates. There are three settings (short, medium, and long) that can be set independently for heat, heat aux and cooling. I don’t mind having my temps vary a degree before the system cycles back on, so I have all mine set to long; during the summer, I may switch cooling to short to see how much of a difference it makes.

Con: I only have one and it is the reason for my 4 rating. The instructions, at least those in the box, should include information on the additional settings that may need to be needed depending on the AC/heating system you have. At a minimum, they should inform you that you may need to make additional setting changes and where to find the instructions online.",5.0 out of 5 stars
Jennie,"Reviewed in the United States on August 11, 2024","Could only connect wifi once. Got a new wifi router for home and tried to set Sensi thermostat using the sames steps as I did before. However, this time around, the Sensi app would not go to next screen once my phone connected to Sensi's wifi. Did many of the troubleshooting steps as researched (instatlled brand new battery for thermostat, ""rebooted"" thermostat, restarted phone, changed phone's wifi settings, etc.) but to no avail. Now, the thermostat is now just a dumb thermo. Had good potential. If app issue gets fixed, this would be a 5 star.

UPDATE: I was able to reconnect the Sensi thermostat. In my original negative post, I tried reconnecting to new home wifi using a different account email address and a different phone. I eventually discovered that if I log in with the app on the original set-up phone and email address, the app would work. Only thing I would have liked is if Sensi would put a warning to use original email address for account login and phone. I recently read this as a potential fix in one of the Amazon's reviews (I hadn't seen this fix in my earlier research). With the app now working and me being able to check on the temperature setting remotely, this thermostat is an easy 5 stars. The additional options in the app such as setting offsets, cycle rates, a/c protection, et. are just great! I have no c-wire so I use a battery, but it is also great that Sensi provides on their website how to wire for a c-wire (without c-wire adapter) by using a jumper but they provide how to install a c-wire adapter so this thermostat give folks few options. I have central a/c and propane gas heater with no c-wire and the Sensi works for my configuration. I will eventually try to wire using a jumper to set-up a ""mock"" c-wire.",5.0 out of 5 stars
Shorebilly,"Reviewed in the United States on August 19, 2024","As soon as we opened the box & saw the tags for the wires, we knew it was going to take awhile to install this & that we would need tech support. Our Lennox system is quite old & only 4 of 8 wires matched the Sensi unit. We called tech support & spoke with Rose who was fantastic. We emailed a pic of our setup to her. She asked that we hold for approx 5-7min. We had to take the panel off of the air handler to look for additional wiring, which didn’t help much. After we clarified that the black wire on our Lennox thermostat was labeled R, not B, Rose was able to confirm what our new wiring arrangement should be. She also helped us reprogram our Sensi thermostat for the new wiring configuration. At that point, the rest was a piece of cake. We were very impressed with the level of knowledge & support provided. The unit works & looks great. Very satisfied & happy with our purchase.",5.0 out of 5 stars
Ronald G. Parker,"Reviewed in the United States on August 31, 2024","I’m very satisfied with my purchase of a Sensi smart thermostat. I have a dual heat system, and didn’t think a smart thermostat would work properly with my rather old heat pump and natural gas furnace. It turns out I could replace my malfunctioning original thermostat with one that I can program and control at a distance with my iPhone. It works great! I contacted customer service two times with a question, one regarding installation and the other regarding controlling heat pump and gas furnace operation. Both resulted in my getting exactly the information that I needed. Couldn’t be more pleased with this product, instructions provided, and customer service!",5.0 out of 5 stars
Brewer W Leggett,"Reviewed in the United States on July 10, 2024","Many 2.4 Ghz devices are network picky, especially initial setup. Personally 25 years plus network engineering, conventional networks to broadband to wifi to mesh- no worries.

First in dumb mode the thermostat works quite nicely, wifi setup - not so much. The mini-setup guide is not very informative and no trouble shooting recommendations. Called tech support around 1:45 pm EDT and waited 49 minutes to recorded tips, no one answered. Customer support SHOULD publish hours phones are manned and SHOULD have a call back feature added to their customer service number. My HVAC home contractor uses one and he only covers two counties.

There were help/tips available on several parts of the vendors website, but you had to be diligent when looking. Bottom line, I performed all available troubleshooting steps with no success in connecting to SENSI XXXXX network. Ran setup process fron Sensi app more than 30 times over three hours without success.

Please reach out before I pack up this thing and send it back.

A Noid.

2ND Comment:

Searching Sensi web site found ANOTHER list of things to try. Last suggestion was use a different device, so I used my tablet that isn't nearly as smartphone. Downloaded app, logged in and same steps in the guide worked immediately!

Cool beans.

No longer A. Noid.",5.0 out of 5 stars
LJP,"Reviewed in the United States on August 17, 2024","First, these were super easy to install. Took me less than 15 minutes per thermostat. Second, I got a rebate from my power company for installing these. Third, I absolutely love controlling them from my phone. If I leave it too cool when I leave home, I can adjust it once I remember. My teenage daughter loves adjusting the temperature upstairs from her phone while in bed rather than having to walk down the hall. Temps are much more accurate than my previous thermostats. I highly recommend these! I bought a different one at first, but it wasn’t compatible and I had to return it.",5.0 out of 5 stars
Dave,"Reviewed in the United States on July 29, 2024","I like the style of the thermostat, and how it looks on the wall. It works really well here in the Southeast Texas humid climate by displaying the humidity on the screen along with the temperature. The Sensi app is easy and straightforward. Whenever the humidity drops below a preset level, I am alerted and can remotely turn on my system. Additionally, you can lock out the front controls and only control the system from the app, which is useful when kids turn the temp all the way down. For the temperature range, this can be set to prevent someone from turning the A/C below a certain point or the heat up to the maximum. For the price, I would definitely recommend this thermostat.

It can also integrate with Alexa and other home automation apps.",5.0 out of 5 stars
T. Baker,"Reviewed in the United States on July 20, 2024","I have been wanting a smart thermostat for quite a while. I finally decided I needed to seriously look for one. I looked at all the major brands and while they have come down in price a little, I was still having trouble justifying the expense since I don't need some of the features, even though they are pretty neat. I just need something that can be easily programmed, and it is nice that I can adjust it from my phone if necessary. This one fits the bill. It does monitor humidity as well as temperature, and is so easy to use. Large numbers on a well lit screen on the unit also, which is great if you have trouble seeing up close without readers, especially in the middle of the night, LOL! It does not work with 5G WiFi so if that's all you have, don't get it. I have a dual signal WiFi, works flawlessly.",5.0 out of 5 stars
Bobby Tables,"Reviewed in the United States on August 29, 2024","Manual and app does not mention - you must have a C wire if using HomeKit, or it will never be detected.

The C wire is connected to the Common terminal of the transformer in the HVAC unit. This provides enough power for wifi to be on continuously. Otherwise it would drain the AA batteries too fast, I suspect, for HomeKit to work.",5.0 out of 5 stars
JVamazon,"Reviewed in the United States on August 29, 2024","I installed two, upstairs and downstairs. The only bump in the road was that one heat pump did the reverse of the standard, heated when it is supposed to cool. All I did was use the buttons on the front to make it compatible. Now we can set the temperature no matter where we are in the world!!!",5.0 out of 5 stars
Placeholder,"Reviewed in the United States on August 26, 2024",This is the second time I purchased this. I moved and wanted it again. The app is amazing and easy to use. Easy to set schedules. Only downfall is I wish I would’ve bought the digital version that you can buy sensors for as we have one room that is much hotter than the rest. This particular thermostat is not compatible with sensors.,5.0 out of 5 stars
Blake Alexander,"Reviewed in the United States on August 10, 2024","I own or have installed at least ten Honeywell wifi thermostats. They have worked well over many years. However. I find the Sensi thermostats to be superior in the following ways:
1) ease of installation. The app for the Sensi thermostats walks you through all aspects of the installation. They have done a great job here.
2) I installed this purchase in rental property primarily for their ability to prevent my renters from setting the thermostats below or above temperature limits established by me. This is easily done in the app and works great.",5.0 out of 5 stars
Robert Masterson,"Reviewed in the United States on August 23, 2024","This thermostat works great, easy installation and good instructions. Note, it cycles more often than our previous Pro1 manual thermostat. I really like the geofencing feature where it turns up the temp 3 degrees when you are 3 miles from your house, and then turns back to the previous temperature when you get within 3 miles.",5.0 out of 5 stars
