Profile Name,Date,Data,Star
Amazon Customer,"Reviewed in the United States on March 5, 2023",Okay so I bought two of these back in July of 2022. 1 was DOA and the 2nd one stopped working in a week. I was able to replace both of them WITH AMAZON because it was inside of the return window for AMAZON but after the 30 days you have to deal with Wyze and the kicker is if you didn't buy them from Wyze directly (having an order number with THEM ONLY) you're out of luck soooooo look just save yourself the time and money and buy another brand....Seriously.,1.0 out of 5 stars
None,"Reviewed in the United States on September 29, 2023","After spending over an hour with tech support, I am returning these. All 6 of the bulbs were stuck on green in different light fixtures in entirely different circuits. During the tech support chat we determined that it wasn’t an issue with the app, the network, the bulb’s firmware being out of date, or the light fixture.
A solution they offered was to send me replacements. If 0/6 worked brand new, I can’t foresee 6 more new ones working any better.",1.0 out of 5 stars
Chris,"Reviewed in the United States on January 5, 2022","I strongly advise not to order these wyze color bulbs. The bulbs themselves are great but the problem is with wyze connectivity. The wyze servers go down constantly and you are unable to control the lights with any app, yes that means you are likely just sitting in the dark and there is nothing you can do. Also sometimes a light will need to be unscrewed and reinstalled to regain functionality Both google and Alexa constantly lose connections linking with wyze. I have to unlink, relink, then reconfigure all the lights, rooms, settings constantly. I have a great internet connection with a high end wireless router. I am tech savvy and can tell you these lights will frustrate you beyond belief. I purchased 12 bulbs, money down the drain.",1.0 out of 5 stars
Mike,"Reviewed in the United States on March 15, 2023","These bulbs are very unreliable, as are the app and software that controls them. I have 4 of them and they frequently go offline and don't respond to the app. The ios app crashes when started about 25% of the time. They are great when they work but frustrating when they suddenly stop working which happens at least monthly. I use them for light fixtures that I want to turn on and off at specific times of day. Old school, simple light timers worked much better; I never had problems with them.",1.0 out of 5 stars
Cassandra C Terrell,"Reviewed in the United States on December 21, 2023","Out of the 4 pack, which I’ve combined to a single group in the app, they have only all 4 worked consistently for about 5% of the time. Usually only one or two will connect at a time and they frequently require re-pairing, which takes forever due to buggy firmware updates.",1.0 out of 5 stars
mike w.,"Reviewed in the United States on October 7, 2023","Bought these lights on Amazon and some from Best Buy. None of my lights lasted longer than 5 months. The longest lasting light is unable to change yellow and flickered when it was set to white. I will never buy from this company again also, they would randomly disconnect from the WiFi and would stop working and the warranty on the bulbs are just short enough to end when the light stops working",1.0 out of 5 stars
Vince F.,"Reviewed in the United States on July 15, 2022","I bought three of these on a Prime-day special. I had read some issues with pairing but thought, ""Oh, how hard could it really be?"" Well, the answer is- for me- impossible. I've tried two out of the three units already and neither of them has paired. The app says it uses BT to find the bulbs, and I can see the bulb under my BT menu in my phone. But when I try to connect it says ""App required."" Well, the app is worthless. Hasn't detected either unit. Forced me to make an account, apparently for nothing as I'm sending these back. The entire pairing process needs to be re-imagined. You would have figured if this many people are having issues, that would have happened already.",1.0 out of 5 stars
Shaun and Rachel,"Reviewed in the United States on June 7, 2023","Literal garbage. They're bright, the color is great. They don't work at all. They don't work with Google Assistant. They don't work in the Wyze app natively. You'll have to set them up repeatedly and keep deleting and re-adding them every day. Wyze cameras are great. Their lights are worse then a dumb bulb because at least a dumb gives you the expectation it's dumb while these are incel bulbs. They pretend they're smart online but in reality they're just some neckbeards that can't fend for themselves.",1.0 out of 5 stars
Kenneth E Neu,"Reviewed in the United States on February 18, 2022","Worked as expected the first week or two: turned on at sunset and turned off at sunrise. Ever since it disconnects from the network every day except maybe two in the past couple weeks. Using standard Xfinity hardware. Did the factory reset a few times. If I unscrew it then screw it back in it comes right on. But if it only turns off at sunrise and doesn't turn on at sunset it has no value. Reviews of other brands with similar features suggest they can also have this problem, but since some people have better luck with this bulb than me, I'm hoping one of those bulbs works better for me than others. Admittedly my hopes are not high.",1.0 out of 5 stars
Amazon Customer,"Reviewed in the United States on March 13, 2024","Doesn't work for more than a day or two then it's offline and you have to delete the device and set it up again. Useless, definitely do not buy this.",1.0 out of 5 stars
Taylor LeGrande,"Reviewed in the United States on March 30, 2023","The light bulbs are fine if you can get the Wyze app to work. Every time (and I do mean every time) I want to turn on/off the lights, I have to spend 10+ minutes opening and re-opening the app due to it crashing — and this is with all firmware/software/devices updated. The app is borderline unusable and the Wyze support team is powerless to do anything about it. Sincerely wish I’d saved myself the headache and gone with Philips.",1.0 out of 5 stars
jdb,"Reviewed in the United States on August 24, 2021","These bulbs require an app on your cell phone that in turn requires a 2.4 wireless connection, and supposedly will set up a wireless network, who knows why, that will allow you to connect to your bulb.
It's nice in theory but it doesn't actually work. The bulb never creates a network and you are stuck with a lightbulb that weighs half a pound, a useless app on your phone.
Maybe just as disturbing as how over complicated an non functioning this piece of garbage actually is, there's more! In order to install the app, you are *required* to give them your phone number and opt in to marketing. This is completely unrelated to the operation of the device - such as it is - and ought to be illegal.",1.0 out of 5 stars
Isaac Alvarado,"Reviewed in the United States on October 23, 2022","In terms of lighting, this bulb is actually pretty good, very bright, I would've like it to be a little less bright, the 1% brightness is still very bright.
Beyond that, the overall experience of using this product is insanely bad. I had trouble (a lot of it) in every single step of the trying to connect, update and program the bulb.
I wouldn't recommend it's use to nobody, I like tech and gadgets, usually don't have trouble dealing with this situations but this product experience is beyond terrible.
Needles to say I threw it away and bought another brand (Panasonic) that far outperformed this piece of crap.",1.0 out of 5 stars
Patrick Kunkel,"Reviewed in the United States on December 30, 2022",I got these to be used outside so we can control timing automatically and also so we could change color to make it a bit festive depending on the time of year. It required an initial firmware update which seemed reasonable however the firmware update has failed for the last week and the support is non-existent. At this point all I have are very expensive bulbs. I would not recommend purchasing them at this time given the lack of prompt support make this product an expensive gamble at best.,1.0 out of 5 stars
Joe Smith,"Reviewed in the United States on April 9, 2024",Defective on receipt.Replacement routed wrong on submission and apparently cannot be corrected by Amazon support 5 minutes later.,1.0 out of 5 stars
Stellz In The City,"Reviewed in the United States on May 14, 2023","Nothing works. I bought a bunch of wyze products, including their smart bulbs, to create a smart house ecosystem and nothing works. The wifi and Alexa integration is terrible. The. bulb worked for a week or so and now it doesn't work at all. I tried reaching out to customer support and no one responded to any of my diagnostic or support request. Don't waste your money and buy something, anything else!",1.0 out of 5 stars
D Becker,"Reviewed in the United States on January 14, 2023","I ordered a 2 pack. Both needed to update firmware, one would not update after many attempts and troubleshooting. I returned it and received a replacement from Amazon. Same problem with replacement bulb. At this point I arranged to return all 3 bulbs and received a full refund for the original purchase. No more WYZE products in my future. (I own multiple WYZE cams and have to babysit them more than I think should be necessary. They will be replaced with a different brand when they do finally fail - and they will.)",1.0 out of 5 stars
D. Harrison,"Reviewed in the United States on March 3, 2022","This was a great bulb for about a week. I bought two. Both have the same issue. After the first week they fell off the network. They are supposed to become discoverable by turning them on and off three times in a row. They will pulse when they are discoverable. Unfortunately they do not pulse when you turn them on and off three time, or any number of times. They only pulse the first time you install them. After that they are just a regular light bulb: no color changes, no dimming, no Wyze app, no Alexa. Just an expensive dim bulb.",1.0 out of 5 stars
Robert Gold,"Reviewed in the United States on January 30, 2022","These are wirecutter-recommended Wyze smart light bulbs? It took me over two hours just to get them working with the Wyze app, but now I've reached two dead ends following online directions.
So that I can use google assistant, I tried to pull the ""WYZE Home"" into my Google home by following google home menus that directed me to log in to my Wyze app. the login/submit button does nothing.
Tried do push Wyze home into google home by following Wyze menus to enable a smart integration with google home, but contrary to the online help page, google home does not appear as an option. These are going back to Amazon.",1.0 out of 5 stars
Jason R Gray,"Reviewed in the United States on March 14, 2024","Of 10 of these we bought over time, 1 was DOA, 2 died completely within three months, 1 still turns on/off but only white and refuses to connect to wifi, and none of the remaining 6 will update firmware despite updates being available and the app screaming at us about it.
Alexa will frequently lose connection with them despite the Wyze app still being able to control them fine.
Really want to like these because of the nice color and brightness performance, but they're just way too buggy.",2.0 out of 5 stars
Shannon Snow,"Reviewed in the United States on September 19, 2023","I wish I had tried these bulbs before I was past the return date. Life got in the way and I stashed these bulbs until I had the time to figure out the set up. I replaced existing Edison style smart bulbs with the hopes of getting more productive grow style lights for my plant wall. The point of smart bulbs is to control remotely. These are NEVER connected. I’m lucky if one actually goes on when scheduled. Currently it’s says the “plant wall” group is off on the app but clearly 2/3 are on. The only way to correct that is to power cycle them. Easy enough, unless the knob to the light fixture is 8feet up your wall and over a dresser. I’m literally trying to sleep with these lights on because I cannot turn them off manually right now. I’m debating just putting my other bulbs back in here and chucking these bulbs. I hate to be out the $ but it’s not worth the frustration. I’ll stick with Cync bulbs and deal with less brightness",2.0 out of 5 stars
D-M0NEY,"Reviewed in the United States on December 10, 2021","I've been a big fan of Wyze ever since I bought their $40 pan and tilt camera 2 years ago. It has always worked great (until recently). But now reading reviews about all the other Wyze products it looks like they're losing their touch. Lots of connection loss and syncing issues. Lots of issues with the Wyze app in general. My camera notifies me all the time with movement outside the detection zone. Wyze is just a hit-or-miss company, there's luck involved with their products working right. They're not reliable anymore. Anyway, this bulb always tells me to upgrade firmware, but it will not connect to my network. And yes, I have it on a 2.4ghz internet connection, not a 5ghz. Its the SAME network another Wyze product is already on! I've tried 5 times now and it just disconnects after a few minutes and makes me go through the pairing process again. The app does connect to the bulb during pairing and I can control some of the features but other features say I need to upgrade firmware to use it. So I'm stuck without the timer feature, the feature I bought it for. Again my Wyze cam is synced and updates fine. The bulb will not update. Also, the sleep routine option doesn't work correctly. It turns on but does not turn off at the specified time. Hopefully I get the firmware updated and all is well. As of now I'm disappointed in Wyze. Thought I found my forever brand....",2.0 out of 5 stars
Brian Jensen,"Reviewed in the United States on October 29, 2021","Similar to many, with the shortages of Hue-related bulbs on the market, I decided to try Wyze' color bulbs. I thought I knew what I was getting into (I have a few other Wyze products around the house), and bought three x4 packs of bulbs. On delivery, 2 of the 12 bulbs were clearly defective -- colors would flicker, or wouldn't illuminate at all -- so Amazon was great and provided for an exchange.
Less than 2 months later, several other bulbs have died (or are in the process of failing). Tried to get support from Wyze first (in the Wyze control app) -- it's laughable at best. At worst, you suspect that this is truly the epitome of using poorly designed chatbots to cut as many corners as possible.
Reached back out to Customer Support at Amazon, and again, they were great. Put my on the phone with a Wyze rep directly, and that's where it went bad again. After a lengthy conversation about all the things we should try to resolve the issue, we got to the point of sorting out a RMA for the multiple bad bulbs, and the Wyze rep promised to follow back up via email as next steps.
3 days later, no response from Wyze, and Amazon is stuck. To be fair, the bulbs (when they work) seem a fair stopgap solution until Hue stock is back to normal, but don't fool yourself that a ~$12 smart color lightbulb is going to perform (or be supported) similar to Hue devices.",2.0 out of 5 stars
Quahog,"Reviewed in the United States on October 4, 2022","I own multiple Wyze products and they offer nice capabilities at a good price when they work. Unfortunately, the Wyze Bulb Color does not measure up. In order to function properly, the bulb's firmware must be kept up to date. As you can see from my screenshot, one bulb is up to date, the other refuses to update successfully. The failed bulb referenced in the screenshot is a replacement for a previously failed Wyze Bulb Color that exhibited the same problem. The bulbs are being used side by side in a ceiling fixture (no dimmer switch on the wall) and are located in the same room as one node of my mesh wifi system, so signal strength is not an issue. I'm now waiting on yet another replacement.
This all comes as a surprise since Wirecutter named this bulb their pick among all smart bulbs. A little research (sadly made after the purchase) shows the problem I am having is a persistent problem with the Wyze Bulb Color. There are hundreds of support queries for this exact issue on Wyze's own support page, and thousands across the web, going back multiple years. Two extended Wyze support chats got me no closer to a solution other than trying another bulb. 🙄",2.0 out of 5 stars
Amazon Customer,"Reviewed in the United States on November 12, 2023","Wouldn't buy again. Just ok, the cheap Phillips Wiz lights work better and do more. Music mode requires a light strip with a microphone to be paired to it. Not the most fluid or intuitive app control. Can't create a pair in the master account and a different pairing in another users account so that's annoying or you can't add the lights to another group if they are in one already. The color production and saturation is nice but they don't get dim enough and don't get super bright either. A couple bulbs also either get frozen and you can't control them or had trouble pairing initially. A few lights also lose connection entirely at random.",2.0 out of 5 stars
Chuck,"Reviewed in the United States on March 8, 2022","I ordered these bulbs with high expectations and was very excited. I received them in a timely manner and installed them. When trying to upgrade is where experienced some difficulty. I had to reinstall them over and over again because it wouldn’t take the upgrade. They kept erroring out. Finally I got them to accept the upgrade in the firmware because that’s the only way they will let Alexa control them. I originally bout 2 of the 4 packs of bulbs and it’s been about 2 weeks and 2 of the 8 bulbs have already burned out and I can’t return them for replacement unless I return all four of a pack. They seem to be great bulbs as far as brightness and color, but if they can’t resolve the quality of the construction of the bulb then they are hardly worth it. I hope they improve because they could be a great bulb and the Wyze company offers a lot of tech products now which makes it great as a one stop shop, but if the quality of these color changing bulbs are a testament to the quality of the rest of their products, they could go down in flames and I’d hate to see that happen as I was looking forward to buying more of their products. As for now I’m going to hold off until they resolve this issue.",2.0 out of 5 stars
jacob,"Reviewed in the United States on May 22, 2023","Was hoping to use these to fix the miserable notification speed that the video doorbell has. Someone could break in and clear house before you were told the doorbell was pressed. Tested out using a Tuya smart bulb to illuminate using IFTTT (free, 3rd party integration service) which would trigger my Google Assistant speaker to announce the visitors. Unfortunately, this hack solution works BETTER than using an all-Wyze ecosystem. Bulb is even more miserably slow to respond to the doorbell, and Wyze has some of the worst Google Home integration I've ever encountered. Despite being just rebranded Chinese white-label products, they perform worse than the cheaper alternatives from the same market. No reason to stay in the ecosystem when it doesn't play nice with itself. Sorry, Wyze. Not so willing to stick with your products since you made the original Sense product-line worthless, swept that under the rug, and just tried again with new products - without any guarantee there was any fix.",2.0 out of 5 stars
Anthony,"Reviewed in the United States on September 18, 2023","These bulbs are great when they work but really suck when they don't. For the most part, things work smoothly. I can ask Google to turn any lights on in any room, there's usually a delay for me for about 5 to 10 seconds before the light actually responds, but that doesn't really matter to me as long as they work. Every month to two months the lights just randomly stopped working. And I have to go through a setup for each light to get them back working and connected with Google. The most recent time I did it they're still not connecting right and it's annoying to not have a sync properly in Google Home or the wyze app for that matter",2.0 out of 5 stars
Bill Andrews,"Reviewed in the United States on January 23, 2023","Setting up the bulbs on the network was painless, but updating firmware was spoty. Discovered as others have noted, update each bulb individually, not as a group.
The second cumbersome task was understanding the menu design. It took viewing several YouTube podcasts to understand how to create groups, seriously!
The third burdensome task was applying color and temperature characteristics. Applying these to one device, no problem; however, multiple bulbs, super complicated, not user friendly!
Last, turning on a group, like bedroom lights, might result in one bulb turning on in the group. I tried many scenarios to get the group to work, but found this a hit or miss operation. What a headache!
I know these issues will not resolve themselves soon. So, I may give up, and remove the groups and operate the bulbs individually. Very disappointing, but considering the cost, keeps the door open for other lighting solutions.",2.0 out of 5 stars
Jose Alvarez,"Reviewed in the United States on September 21, 2022","I bought this pack with two units on November 2021, and now (September 2022) both have just died.
One of them just got bricked on that red color in March 2022, impossible to enter pairing mode, I got a gift card as a replacement from Wyze.
Now another one just died, and it is impossible to enter the pairing mode, it was next to the internet modem, and sometimes it just disconnected from the internet and came back as usual (I don't know why) now it's showing a cloud, I tried to do the setup as a new but it's not turning on, any of the colors are turning on. I subbmited a log on Wyze App, customer service is great, but I don't think that is a long-life product, Wyze have to improve on the quality of the color bulbs.",2.0 out of 5 stars
Zach Taylor,"Reviewed in the United States on November 20, 2023","I generally liked this bulb, but after 5 months, it switched to red and stopped resetting, connecting, or changing to anything but red. I also wish it could work without an external network connection.
Edit: Wyze has offered to replace the bulb. When the replacement comes, I'll try to remember to update this review.",2.0 out of 5 stars
Alyssa Dittmann,"Reviewed in the United States on December 2, 2022","These are the best bulbs as far as brightness and color for the price. But the app crashes constantly. If I adjust the color or brightness, it crashes. Sometimes it will crash before I can do anything. It takes a while to adjust my bulbs. If I want to turn in a bulb, change the color, and brightness I need to open the app at least 3 times. For two bulbs, it becomes 6+ times. And the startup is slow, which I could tolerate if the app didn’t crash.
Support never provided a solution.
If they would fix the app so it doesn’t crash, this would be 5 stars. But at the moment it is almost unusable.",2.0 out of 5 stars
ula,"Reviewed in the United States on February 28, 2023","I bought 6 bulbs as a starter kit for my home, and within a few months 2 bulbs had failed. I went through 3 days of back and forth to troubleshoot the bulbs and then they sent 2 new ones to replace those, and one has failed since then. I have since returned to plain led bulbs which have been fine, no problems in the same light fixtures. Unfortunate because otherwise they're a solid no frills option for smart lighting, and I liked the scheduling options, but the failure rate is way too high to justify continuing to use them.",2.0 out of 5 stars
Joshua Rich,"Reviewed in the United States on February 5, 2023","Can’t turn lights on or off without crashing the iPhone app. We only have four bulbs! But it can’t handle it.
I tried support 3 separate times. They couldn’t do anything, just told me to send them reports so they could keep improving the app.
My wife likes them and I’m not ready to drop double the money on Hues, so we’re stuck for now.
In other news, the things I’m able to review are brightness, longevity, etc. it’s surprising to me that I’m not allowed to rate the app or overall product performance.
The ratings above reflect overall performance.",2.0 out of 5 stars
RiddleN,"Reviewed in the United States on January 1, 2024","Bought these a year ago, and they have never really worked with my Google home correctly. One bulb constantly disconnects, and recently it has started glitching and flashing/fading. I'm switching to Govee bulbs.",2.0 out of 5 stars
Doug,"Reviewed in the United States on December 7, 2021","I own Wyze cams (V1 and V3) and Wyze lights (post 2019 and color bulbs). I have a strong mesh signal to all my devices. You do have to turn off 5 GHz band when setting up your devices but once connected you can reactivate it. I am stumped why cameras and bulbs have so many problems. Over the past year all my devices will go off line in groups (meaning all the cams will go out, another week all the outside bulbs go out). It’s not the network, all my other devices have been stable. Wyze support while polite is of little use; they guide you thru the set up routine again and again, ask you to reset your modem and then tell you their engineers will have to look at the issue. Some hours or days later the devices (hopefully) come back on . I’ll have to do some research and find a more dependable brand.",2.0 out of 5 stars
