Profile Name,Date,Data,Star
José Mundo,"Reviewed in the United States on August 8, 2023","My kids love these light bulbs because they can turn them to the color that they want depending on the mood and occasion. The color that they like the most is the blue one.

Going to technical stuff:
1. They only connect to 2.4GHZ wifi which is not good, and in may case even worst, because the network that works the best in my house is the 5.0 GHZ one
2. From time to time they get disconnected or starts to work erratically. The solution turn the light off and on again
3. Connecting and configuring them is really easy",5.0 out of 5 stars
Tyler Carbonelli,"Reviewed in the United States on July 23, 2024","We recently got a few Wyze Bulb Color four-packs, and these bulbs are amazing! They are super bright at 1100 lumens, way brighter than the usual 800 lumens we had before. They can also dim down to 30 lumens, so we can get the perfect lighting for any mood.
With 16 million colors to pick from, it’s easy to set the vibe for any occasion, from game days to chill wine nights. The Wyze app makes it really simple to change colors and create custom presets for quick scene changes. Plus, the white light temperature control is great for cooling down the light for focus or warming it up for relaxation.
The 90+ CRI rating is fantastic, making colors look more vibrant and accurate. It’s been a lifesaver in the closet, where I no longer mistake navy for black. The bulbs also have cool notification features, allowing us to set time-based color events or automate them with other Wyze devices for handy visual alerts.
Our whole house now has Wyze light bulbs in each room, along with our Wyze air purifier, Wyze plugs, Wyze Robot Vacuum, and Wyze hand vacuum. Having all these Wyze products has turned our home into a super smart and convenient space.
Overall, these Wyze Bulb Color smart bulbs are bright, versatile, and fun to use. They’ve really improved the lighting in our home, and I highly recommend them for anyone wanting to upgrade their lighting!",5.0 out of 5 stars
zoomlittlewing,"Reviewed in the United States on June 20, 2023","We replaced all of our stand alone light bulbs in our house with Wyze bulbs over the last 6 months. We love our movie nights, dates nights and evening wind-downs thanks to these bulbs. They truly can create almost any color you can think of and we love that the brightness and tone is adjustable with just a few tweaks. The dimming feature allows for me to stay up reading with my bedside lamp on while my husband turns off his bedside lamp sleeps.
Solid 4 star product - easy to install, easy to pair and easy to set up on the app (there may be a learning curve if you’re not very familiar with how modern-day mobile applications pair with devices).
The reason it’s not 5 stars is largely because the developer software updates being buggy. Sometimes it won’t connect to their devices at all, or it will connect but have a lag time for any adjustments you make or making adjustments can crash the app. The only way to fix this is you have to uninstall/reinstall it. Fortunately it doesn’t erase your devices or history, and it only happens every few months (lately haven’t had issues), so it’s not the end of the world.
We were also shocked it’s not compatible with Siri, but works with Alexa and other voice command apps. We didn’t even think to research this when researching since the iPhone is the leading mobile device out there. That seems like a huge miss on the Wyze development team’s part - its clear they don’t want to pay Apple’s ridiculously high fees in the App Store and for Siri development APIs. Hopefully, they will one make the investment and upgrade their app to include it.",4.0 out of 5 stars
Alison,"Reviewed in the United States on September 28, 2023","I bought this bulb when I was looking for a sunrise alarm clock, but I couldn't find one with the functions I wanted in my price range. I knew I wanted to be able to set it on my phone in case I wanted to wake up at a different time one day. I really like the sunrise function on this bulb. I can easily set it on my phone and have it only run the sunrise on weekdays (or days of your choice). Although I can't set more than one time on different days, it's easy enough to change if I need to. I don't think I would wake up from the sunrise alone, but I use it in a floor lamp, so it may work if you had it closer to your face. I set a regular alarm and start the sunrise at the alarm time, and have it end by the time I hit snooze a couple of times. I do feel more awake at the end of the sunrise. If you have the sun color match setting on, the sunrise comes all the way up to a bluer daylight and then resets to the sun shade for the time of day.
I also really enjoy the sunset feature. I run it while scrolling on my phone and by the time the sunrise is over, I know it's time to go to sleep. I even feel sleepier at the end of the sunset than I do without it. You can set the length of time you want the sunset to span (same with the sunrise). The shortest amount of time is 20 mins, but I wish I could set it for a speedier 10 min sunset when I want a quick unwind.
The app is easy to use, and if you have other Wyze products, they all live in the same app. I recommend setting up a widget for your home screen for easy on/off. It's super convenient to turn the light on from another room when you're walking to your room at night, or turn it off if you forgot to when leaving the room.
I haven't used too many of the other fun colors, but from playing around with them they are really cool! You can set any color you want and the app even has color and brightness options for different moods. The bulb is bright enough to light a decent sized room in a floor lamp, though the cooler colors seem brighter than the warmer colors. It's very easy to play with the color wheel to pick your perfect color/warmth and brightness though.
Overall, this bulb exceeded my expectations for the sunrise function I was looking for, and I'm enjoying playing with the other color and mood options as well! I never thought I would write such a long review for a lightbulb, but I'm really loving it that much.",5.0 out of 5 stars
Cory,"Reviewed in the United States on August 25, 2024","I want to like these, the concept is great, change color, dim the lights, by using an APP or voice command, so I bought 20 and put them all over my house.... Bad IDEA!!!! It has been more trouble than the benefits. I have already had to go through customer support to exchange at least 4 light bulbs and now I am just throwing them away, waste of money, time and frustration.
A few example's of the fun that awaits you
1 out of 6 lights in a fixture will not turn on sometimes
1 out of 6 lights in a fixture will not turn off sometimes
1 light out of a group will decided it no longer wants to match the other colors no matter what you try
1 light out of a group will just stop working
Oh no you forgot and used the light switch once and now when you turn them on or off using voice command, or the APP, you will play Russian roulette with them, because in random order all but one of them will work.
These are good if you only want to use one or two of them in a fixture and don't mind replacing them potentially within a year.",1.0 out of 5 stars
Wm D. S.,"Reviewed in the United States on January 27, 2022","I bought two of these, one for my wife's lame and one for mine. She loves them! We put them on the color or our favorite sports teams while watching games and we both love that we can turn them on and off from anywhere. For example, we can turn them on in the living room from bed in the morning when it's still dark out so we don't have to turn on overhead lights along the way. Or at night we leave them on when we leave the couch on our way to bed and then turn them off once we are in our bedroom. Heck of a lot better than stubbing your toes walking around in the dark looking for light switches!!! The only suggesting I have for these would be if we could put them on some kind of random color mode so they would just adjust on their own. Instead they are constantly whatever color you set them to and have to be manually adjusted. It can't listen to music and make cool color changes or anything like that either. It's just a wireless remote controlled light bulb that you can change the color on using the app. It also has a vacation mode but doesn't say what the timing will be for that. It also lacks a timer mode which would be cool if you could set it to turn on and off with different colors at different times of the day. Over all it's probably a waste of money but we like them.",5.0 out of 5 stars
Robert A Fogg,"Reviewed in the United States on August 29, 2024","I bought 8 wyze color bulbs, 2 4-packs, and of those initial 8, 18 months later, only 3 remain. 1 stopped changing color and would only turn on green. 3 have stopped communicating with the wifi and are non responsive and one connects and shows as there but doesn't light. I'll be switching to other products that have longer lifespan guarantees. When a standard LED bulb can last for decades it's ridiculous that an IoT bulb doesn't last for 2 years...",3.0 out of 5 stars
Joshua Frasher,"Reviewed in the United States on November 23, 2023","The Wyze Bulb Color has truly elevated my lighting experience with its exceptional features. The 1100-lumen brightness provides ample illumination, creating a vibrant and inviting atmosphere in any room. The dimming capability allows for versatile control, effortlessly transitioning between different moods and activities with a simple adjustment.
One of the standout features is the absence of flickering or blinking during operation. The steady and consistent light output enhances comfort and prevents eye strain, making it ideal for prolonged use. The reliability of the Wyze Bulb Color instills confidence, ensuring a stable and enjoyable lighting experience.
The fit into my smart home ecosystem was seamless, thanks to its WiFi connectivity. The Wyze app facilitates convenient control, allowing me to manage the bulb's color and intensity with ease. The appearance of the bulb is sleek and modern, adding a touch of sophistication to my living spaces.
In summary, the Wyze Bulb Color excels in providing a bright, versatile, and comfortable lighting solution. Its dimming capabilities, flicker-free operation, and stylish appearance make it a standout choice for those seeking both functionality and aesthetics in smart lighting.",5.0 out of 5 stars
Vikki,"Reviewed in the United States on August 30, 2024",Initially a pain to hook up. One bulb was a cinch but the 2nd bulb refused to sync up and work with Alexa. Called customer service. The gal I spoke to wasn't the friendliest person I've ever dealt with but she was tenacious and kept working at walking me through (repeatedly) all the steps until it finally decided to work correctly. I'm happy with the white color of the bulb - it's very very bright white; unlike other smart bulbs I've had.,4.0 out of 5 stars
Some Guy,"Reviewed in the United States on August 30, 2024",Awesome little light bulbs easy to set up very nice,5.0 out of 5 stars
jbcorcor,"Reviewed in the United States on January 4, 2024","These are really cool - we have 2 in the overhead light in our kids' room and they love it. We set it to do a wake-up brightening routine and a bed-time darkening routine and it's been helpful on both sides.
The brightness and color range are great - covers the spectrum pretty well, especially when you have more than one bulb.
Downsides:
- They respond quite slowly when you make changes in the app, which means I often click the wrong thing or end up pushing buttons too many times because I think it didn't register the change the first time.
- Because there's no physical switch, all of the changes have to be made in the app. I don't really let my kids tool around on my phone and we don't use Alexa (or any other voice assistant), so it means that any lighting changes have to go through me or my husband.
Side note: We also got some strip lighting for their room (Govee brand) and I like how those can play ""scenes"" with moving lights. It feels a little more fun to me.
All that being said, I'm happy with this purchase and would recommend them to people who aren't going to make frequent changes to the lighting settings.",4.0 out of 5 stars
Stefanie,"Reviewed in the United States on August 2, 2024",The kids LOVE them. Lasted over a year I'm buying more for other places the ones I bought last time are still working in every color over a year later. I'd give waze more stars if I could.,5.0 out of 5 stars
J,"Reviewed in the United States on August 12, 2024",I have bought these three times now. Very easy to use with the app and to coordinate all the different lights together.,5.0 out of 5 stars
Paul M Cotton,"Reviewed in the United States on August 1, 2024","Easy to setup, very affordable versus others. Have had one for years now no issues. Got more for other rooms in the house, app lets me set up different rooms and day night settings. Love it.",5.0 out of 5 stars
HeySupDan,"Reviewed in the United States on June 6, 2024","I love the Wyze products, I have issues with cameras and outdoor plugs, but for the most part you can’t beat their prices",4.0 out of 5 stars
Shay,"Reviewed in the United States on June 14, 2022","The good: Really happy with the brightness of these lights as well as the customization. They keep my home well lit at night - and I like my home to feel like it's in daylight at all hours, so that's saying something. Even when you use the colored light settings, the brightness stays consistently strong (unlike with a cheaper colored smart bulb I have tried from Genii). You can customize by brightness, color as well as saturation (white to colored), and while the colors tend to lose definition disproportionately quickly as you desaturate, I haven't had a single setting I've tried that looked bad. Sometimes I have to tweak to get exactly the color I want, but the range is good enough that I can typically find the effect I want. Have used these bulbs for several months now and haven't had to replace any yet.
The bad: If you get a faulty bulb, customer service WILL give you the runaround. Ostensibly they will replace faulty bulbs, but I've been going back and forth with them for weeks to try to get them to send me a replacement bulb. Every couple of weeks a different customer service agent responds to the thread to say they need the MAC address or bulb ID; then I respond that I've provided all the text the bulb had on it and no longer have the device connected, so can't confirm any information, so can they please just send me a replacement? And then they respond again saying ""okay yes let's try something else can you send me the MAC address it should be on the outside of the bulb."" So, make sure you test your bulbs as soon as you get them so you can go through Amazon returns and don't have to deal with the Wyze team.
The other problem I encounter is every so often, some/all of my bulbs just stop responding to commands. Sometimes this just goes away if I wait a few minutes. Sometimes I have to fix this by reconnecting the Alexa skill and/or operating through the Wyze app until I find a minute to reset. Sometimes, neither the skill nor the app work, and if the light is frozen in the off position when this happens, I can't tell if it's ""on"" or ""off"", and then it doesn't go to reset mode right away after I flip the lights three times, and I keep turning the switch slowly on and off for several minutes until I get signs of life. I'll try unplugging the light altogether or unscrewing the bulb but haven't figured out a consistent workaround to get them to promptly reset when this happens. It's possible it's a sync issue with my router, but I have very high internet speeds, a really heavy duty router, and a really small house, so that's less likely.",3.0 out of 5 stars
Lawrence Sterne,"Reviewed in the United States on March 24, 2024","These bulbs are really cool. You can adjust the color, brightness and warmth using a plain (i.e., not 3 way, socket). You can create any ”environment“you want. If you are reading, for example, you might want something brigher. You can replicate sunlight or moonlight. You can make any color you want. Best of all, you can just ask Alexa to do it for you. On the downside, I had to replace a three-way socket and one completely variable socket because the lights flickered. But that's a one-time event.",4.0 out of 5 stars
Troy McKinlay,"Reviewed in the United States on May 28, 2024","I used to have the 2019 version and omg, this is so much better. The blubs are lighter which is cool, and they pair so so easily. Screw it in, follow the apps instructions. No wifi bs, just connected. The color is really, really cool and the variety is great. I love a warm, warm light and these are perfect. The controls are intuitive and you can set up schedules so I use the lights to help wake me. There are also quick buttons you can make- I have one that turns on all the lights for when I get home.
I am neuro diverse and have PTSD so it is hard to feel good enough to go to sleep and having such excellent control makes my life just easier",5.0 out of 5 stars
RZ,"Reviewed in the United States on July 31, 2024","We use these bulbs for atmosphere, for reading and for using dimmer lighting for our dining area.",5.0 out of 5 stars
Scott,"Reviewed in the United States on July 31, 2022","The hardest smart device to set up I've bought in a long time. And I've bought quite a few. Long story short: the Wyze App said White bulb, this is color, there was no other option until it was set up, then Color appeared; while the bulb pulsed right away, meaning ready to set up, the app refused to accept my Wifi password as valid, even after I rebooted the Wifi as instructed. Have to use 2.4 g, which is ok, but it took about 8 tries before it finally accepted my password. But then it still would not link to the bulb. I turned the bulb off and back on, as instructed, rebooted, as instructed, no luck. FINALLY, after about 15 ties, for no apparent reason it then linked successfully. B
But then it said I needed a firmware update. Yet every time I tried to update, the app told me the device was offline, not linked to internet. So I could not set up any of the functions i wanted. Alexa app immediately recognized the bulb, but Alexa could not perform any of the functions, either. Time and again I turned my Wifi off and back on, bulb off and back on, only to be told it was still offline. All my other Wifi devices in the house were performing fine in the meantime. There was nothing wrong with my Wifi. Finally, about two hours later, I came back and tried again. Finally, on about the 15th or 20th time trying to update, the firmware updated. And I was able to set a time schedule.
But just now I discovered the time schedule I saved only saved the start time, it was showing no end time set. So I have again set the end time. But WHAT AN ORDEAL!
I should add that it is not easy to find the menu item where one sets a time schedule. It is NOT under Schedule. It is under Rules. And when it turned on today, it did not turn on to the brightness I had set.
So all in all, the jury is still out on this. Alexa can now turn the light off and on, adjust its brightness, and even change the color. SO this may turn out to be terrific. But getting there was NOT half the fun.",3.0 out of 5 stars
Kindle Customer,"Reviewed in the United States on January 11, 2023","These bulbs are nifty and can be set to do neat things like go on automatically at sunset wherever you are, and off at a particular time. But it takes some time and effort to figure out how to get them to do this. Once you finally figure out how to set the color bulb it is fun and helpful. For the bulb to follow a schedule you have to set up a “rule”. The instructions on how to do this are a bit obscure.
I was having trouble making the bulb work so called their support desk. After about a half hour, and no joy, I went back to trying to figure it out on my own.
The instructions on the Wyze website under support Using Rules with Wyze Color Bulb are helpful but they leave out an important step. You will find couple of different ways to get to the “Add Rule” screen but there is no instruction for how to connect to the bulb you want to control. It just says “Add the bulb you want to connect.” What is missing if that you have to select “Add action” and then select the bulb.
To summarize: Set up your bulb so it is seen by your phone app. Name it. Select the color you want to use and bulb brightness. Save as a “scene”. Go to Rules tab (from color screen or home screen) Select +(plus) Select “add rule” and then schedule. Select add action. Select the bulb you want to assign a schedule. Select “turn on” – Save. Set “start time” and “end time”. Name the sequence. Save.
We are quite pleased with the bulb and all its capabilities now that it is working correctly.",4.0 out of 5 stars
music lover,"Reviewed in the United States on August 25, 2021","I now have a total of 5 Wyze devices, 3 plugs, and 2 color smart bulbs (Master Bedroom - furthest point from router/modem)), all are working flawlessly. Many of the reviews mention the app and wifi connectivity being an issue. To be clear connectivity is a function of the wifi service available in conjunction with the app. Every wifi connected device draws from the available download speeds as received from the internet provider. In my case I have download speeds of 500 Mbps, this may sound like a lot, however the speeds change depending if the network is hard wired (ethernet), or wireless. Wireless can in itself reduce the download speeds by as much as 50%, and if a VPN is being used the download speeds are reduced again (see where this is going?). I run a combination of ethernet and wireless. Ethernet runs my desktop, VPN, 4 security cameras, printer, and NAS. Wireless runs 4 Firesticks, 2 laptops, 2 phones, garage door opener, Nest thermostat, Echo Dot (Alexa), and the 5 Wyze products. This is a total of 24 devices drawing from a download speed of 500 Mbps. Now for example, if someone has let’s say a service of 100 to 200 Mbps, and many devices connected, connectivity issues could be a real problem. Taking this one step further, the 2 Wyze color smart bulbs are installed in the Master Bedroom and closet which are furthest away from the modem/router. When I originally connected/paired the devices to the app (using the 2G connection), the lights worked, but there was a definite lag when powering on/off and/or changing color scenes, or using voice control (Alexa) which was even worse, sort of frustrating. My home network is broken out to 6 different connections, a 2G, 5G, 2G EXT, 5G EXT, Guest 2G and Guest 5G. The fix for the issues in the Master Bedroom and closet was changing the wifi connection on the 2 Wyze bulbs from 2G to 2G EXT, as I have a NETGEAR network extender plugged into the bedroom outlet, problem solved. The real reason for this review is to provide information as to how download speeds and number of connected devices work, and share the internet signal. Hope this provides some useful information!
OBTW an alternative solution in leu of adding individual wifi devices is going with a product that runs off of a hub, which is connected via an ethernet cable directly to the router/modem, and the individual devices are controlled by the hub and associated app, the hub counts as only one connection!",5.0 out of 5 stars
Cameron Wilde,"Reviewed in the United States on July 14, 2022","I really appreciate the Wyze brand for having so many smart products at such a low price. This is where their products shine, and the Wyze Color Bulb is no different. Now, I will say that the software side of these does have some small problems occasionally, but all I do is say, “eh, but I didn’t pay that much for ‘em,” and I’m perfectly happy.
I can’t speak toward the Alexa integration, because I haven’t used it, but I will say that these bulbs get better in conjunction with other Wyze products. For example, I have a Wyze Watch that has Shortcuts created in the app to turn them on or off, or change color or brightness settings. I have motion detection with my Wyze Cam that, when it detects a person in the middle of the night (so, distinct from my dog), then it’ll turn the lights on at low brightness for five minutes and then turn back off.
Even without ancillary Wyze devices, they do very well simply on schedules alone. The lights turn themselves on in the morning, they turn themselves off when I leave for work, and I have them set to turn on when I approach within 1000 feet of my house if it’s between certain times of day.
The colors work great. I use several different Scenes in the app to create mood lighting for when I host Dungeons and Dragons at my house. With different light settings, I can make our living room feel like a cozy tavern, an open country field, or an unexplored ancient cavern. I use the color settings of these lightbulbs on a weekly basis.
Overall, you’re getting a lot for what you’re paying for, compared to other smart color bulbs.",4.0 out of 5 stars
